|text|flg_crime|cat_crime
93|Quem não gosta de receber um presente inesperado no dia do seu aniversário? Um mimo daquela loja ou marca onde você costuma fazer compras. No entanto  é importante manter a cautela diante de grandes ofertas e oportunidades. Muitas vezes  elas escondem possíveis golpes. O Fantástico mostrou flagrantes do golpe do brinde  que vem transformando datas comemorativas em decepção e prejuízo.        Segundo os especialistas  este tipo de golpe tem sido cada vez mais comum. Bandidos se passam por empresas e entram em contato dizendo que vão enviar um presente  e que a pessoa só precisa pagar uma pequena taxa de entrega. Os golpistas dizem que não aceitam dinheiro em espécie  e é na hora de passar o cartão e digitar a senha que o crime acontece.            Golpistas se passam por entregadores para fazer vítimas no dia do aniversário delasGolpe do presente  em compras na internet ou no cartão por aproximação: Procon PR alerta sobre como se protegerGolpe do aniversário: suspeitos faziam entregas de cestas de presente e depois clonavam cartão das vítimasGolpe do bilhete premiado: entenda golpe em que criminosos convencem vítimas a entregar dinheiro e joias em troca de prêmio falsoSaiba como se proteger do ‘golpe do aniversário’  crime cada vez mais comum no BrasilGolpe da maquininha: entenda crime em que golpista cancela transação antes de fazer pagamento e imprime papel para simular compra realizada       E a gente se pergunta: como se proteger? O que fazer se você cair num golpe?       Neste episódio  Renata Capucci recebe José Milagre  advogado e perito especializado em crimes cibernéticos  e Emmanoel David  delegado titular da Delegacia de Estelionatos de Curitiba  que dão dicas de como evitar cair em golpes de forma virtual ou presencial.      Isso é de extrema importância. Jamais clique em links ou confirme códigos por SMS. Essa é uma abordagem comum atualmente. Recomendamos até que substitua o SMS como segundo fator de autenticação por outros mecanismos mais eficazes  como os autenticadores  diz o advogado José Milagre.                                    Polícia Civil registra golpe em que falsos entregadores escolhem vítima pela data de aniversário|S|Golpe bancário
94|Carro usado pelo suspeito de matar homem esfaqueado e queimado em Teresina Foto: Eric Souza/ g1 Piauí     Carro usado pelo suspeito de matar homem esfaqueado e queimado em Teresina Foto: Eric Souza/ g1 Piauí                Um homem  ainda não identificado  foi assassinado e teve seu corpo queimado na Vila Santa Bárbara  na Zona Leste da capital na noite da terça feira (4). Segundo a Polícia Civil  um homem foi preso suspeito pelo crime.        ✅ Siga o canal do g1 Piauí no WhatsApp       A vítima ainda não foi identificada  ele não estava portando documentos de identificação. O Instituto Médico Legal (IML) fará perícia para descobrir se ele foi morto pelos golpes de faca ou pelo fogo. De acordo com o diretor do IML  o médico legista Antonio Nunes  a família compareceu ao instituto  porém o corpo ainda não foi liberado.            O corpo ainda está em processo de identificação posto que o prontuário de registro civil só chegará amanhã e se vai tentar por impressões digitais  de início. Caso não seja possível  se tentará por outros métodos como o genético  afirmou.       Segundo o delegado Francisco Bareta Costa  coordenador do Departamento de Homicídios e Proteção à Pessoa (DHPP)  a Polícia Militar foi informada de que um vendedor ambulante havia sido esfaqueado e sequestrado por um homem na zona rural de Altos.      Compartilhe esta notícia no WhatsAppCompartilhe esta notícia no Telegram      Testemunhas informaram à Polícia Civil que a vítima foi golpeada com um facão e  em seguida  colocada dentro de um carro  que seguiu com destino à Teresina.       Horas mais tarde  a PM localizou o carro que foi usado no sequestro e um corpo de um homem ainda em chamas. O suspeito pelo crime tentou fugir do local ao ver os policiais  mas foi preso. O carro foi apreendido e também vai passar por perícia.       O homem foi levado para a Central de Flagrantes e autuado. Ainda não se sabe o que motivou o crime. O DHPP irá investigar o caso.       Confira as últimas notícias do g1 PiauíAcompanhe o g1 Piauí no Facebook e no Instagram e no X            VÍDEOS: assista aos vídeos mais vistos da Rede Clube         50 vídeos|S|Golpe bancário
95|Carla Zambelli deixa o Brasil e diz que pedirá licença do mandato                A deputada Carla Zambelli (PL SP) disse nesta terça feira (3) que deixou o Brasil e que pedirá licença do mandato. A viagem acontece 20 dias após ela ser condenada  pelo Supremo Tribunal Federal (STF)  a 10 anos de prisão pela invasão ao sistema do Conselho Nacional de Justiça (CNJ) e falsidade ideológica.        A Procuradoria Geral da República (PGR) entrou com pedido de prisão da deputada após o anúncio de que ela deixou o Brasil.       De acordo com a Justiça  Zambelli contratou o hacker Walter Delgatti Neto para invadir o sistema do CNJ e inserir documentos falsos  incluindo um mandado de prisão forjado contra o ministro do Supremo Alexandre de Moraes. A condenação inclui perda do mandato e multa por danos morais coletivos.            Zambelli também é alvo de outros inquéritos e ações penais no STF e na Justiça Eleitoral. As acusações envolvem desde porte ilegal de arma até articulação para disseminar fake news e tentativa de golpe. Parte das investigações corre sob sigilo.      Veja quais são os inquéritos e ações dos quais Zambelli é alvo:     Ataque hacker aos sistemas do CNJ      Zambelli e o hacker Walter Delgatti foram condenados pela Primeira Turma do Supremo Tribunal Federal (STF) pela invasão aos sistemas do Conselho Nacional de Justiça (CNJ). Os ministros entenderam que a deputada e Delgatti cometeram os crimes de invasão de dispositivo informático e falsidade ideológica. A pena imposta é de 10 anos de prisão para a deputada.      Porte ilegal de arma de fogo e constrangimento ilegal      A deputada também é ré em uma ação penal no STF por porte ilegal de arma e constrangimento ilegal.       O caso se refere ao episódio de outubro de 2022  quando ela sacou uma arma e perseguiu pelas ruas de São Paulo um apoiador de Lula (PT)  então candidato à presidência.       Em março de 2025  seis ministros votaram por sua condenação a 5 anos e 3 meses de prisão  além da cassação do mandato  mas o julgamento foi interrompido após pedido de vista do ministro Nunes Marques.                  Infográfico   Ações contra Carla Zambelli no STF. Foto: Arte/g1     Infográfico   Ações contra Carla Zambelli no STF. Foto: Arte/g1       Inquéritos sigilosos no STF      Zambelli também é investigada em dois inquéritos sigilosos no STF. Um deles  é o chamado “inquérito das fake news”  que apura a disseminação de notícias falsas e ataques a ministros do Supremo.       O outro  o inquérito das milícias digitais  investiga a suposta participação da deputada em articulações golpistas após o resultado das eleições de 2022.      Justiça Eleitoral      Na Justiça Eleitoral  a deputada foi condenada por uso indevido dos meios de comunicação e abuso de poder político nas eleições de 2022.       O Tribunal Regional Eleitoral de São Paulo (TRE SP) determinou a cassação do mandato e a inelegibilidade por oito anos. O caso está em fase de recurso no Tribunal Superior Eleitoral (TSE).|S|Golpe
96|Usuários de internet devem ficar atentos a possíveis golpes Foto: Marcos Serra Lima/g1     Usuários de internet devem ficar atentos a possíveis golpes Foto: Marcos Serra Lima/g1                Um levantamento da Secretaria de Segurança Pública de São Paulo (SSP SP) mostra que o número de crimes cibernéticos cresceu em 2022. Só nos primeiros seis meses do ano passado  o estado registrou mais que o dobro do que o total de ocorrências de todo o ano de 2021.       Compartilhe no WhatsAppCompartilhe no Telegram      Essa realidade também se repete em outros estados brasileiros. Além dos famosos golpes  criminosos usam a internet para cometer cyberbullying e praticar crimes de ódio  com discursos racistas  homofóbicos e intolerantes contra minorias.       Diante do aumento do número de casos envolvendo a internet  a SSP SP elaborou uma cartilha para que as pessoas saibam como se proteger e denunciar crimes do tipo. Leia na íntegra clicando aqui.             Segundo o documento  a população mais vulnerável aos crimes digitais são mulheres em situação de violência doméstica  que muitas vezes são expostas no meio digital  além de crianças e adolescentes.       O órgão alerta ainda que os golpes pela internet estão se tornando cada vez mais frequentes  com a criação de anúncios falsos que  em muitos casos  são impulsionados por perfis fakes.      Como evitar cair em golpes na internet?      Veja a seguir algumas dicas para não cair em golpes na internet:      Desconfie de prêmios ou ofertas que possuem valores anormais Consulte os canais oficiais das empresas vendedoras e o histórico de reclamações de consumidores em plataformas confiáveis  como o consumidor.gov.br Nunca informe logins e senhas bancárias ou de redes sociais Não repasse informações pessoais pela internet ou telefone sem ter certeza de que está conversando com um canal oficial de uma empresa confiável Use cartões virtuais para realizar compras pela internet. Atualmente  os bancos já oferecem essa opção para quem tem cartão de crédito Use verificação em duas etapas para redes sociais  como WhatsApp  para evitar ter suas redes sociais invadidas. Veja como fazer clicando aqui Antes de clicar em um link  verifique se ele é confiável.     Fui vítima de crime  e agora?            A SSP SP orienta vítimas de golpes ou de crimes cibernéticos a adotarem algumas medidas para facilitar na investigação policial. Veja a seguir:      Salve o endereço eletrônico ou informações sobre o golpista ou agressor Anote números de telefone do criminoso Salve prints de conversas que teve com o golpista ou agressor Se foi vítima de golpe com transferência de dinheiro  anote a conta bancária a qual o valor foi enviado Em caso de suspeita de invasão  coloque o celular no modo avião e se desconecte de todas as redes de internet  como Wi Fi e 4G Procure uma delegacia de polícia mais próxima para registrar a ocorrência. Para emergências  utilize o telefone 190 da Polícia Militar.                             Operação policial contra loterias ilegais cumpre mandados em três estados saiba se prevenir contra estelionatos              VÍDEOS: Hora 1         50 vídeos|S|Golpe Bancário
97|O golpe da biometria                A biometria facial  que foi criada justamente para dar mais segurança ao mundo digital  também está sendo usada em golpes no Brasil inteiro. Estelionatários inventam desculpas para supostamente tirar fotos das vítimas  desde uma visita de supostos agentes de saúde até uma promessa de emprego. Na verdade  o que eles querem é desbloquear empréstimos e financiamentos.       “O rosto hoje é a senha. Ela é a porta de entrada. Ela é a chave para abrir a sua conta bancária  para abrir diversas aplicações que você tem por aí”  afirma o especialista em cibersegurança Álvaro Massad Martins.      A biometria facial passou a ser usada com mais frequência a partir de 2020  inclusive para assinatura de documentos. Ela é considerada uma das tecnologias mais seguras para identificação de pessoas  já que leva em conta as medidas de vários pontos do rosto.                  Conheça as estratégias dos banidos e não caia no golpe da biometria facial Foto: Fantástico/ Reprodução     Conheça as estratégias dos banidos e não caia no golpe da biometria facial Foto: Fantástico/ Reprodução       Falsas agentes de saúde      Em São Bernardo do Campo  na Grande São Paulo  duas falsas agentes de saúde dizem para a vítima que a visita a domicílio é para antecipar uma cirurgia pelo SUS que ela havia agendado. No apartamento  elas fingem tirar uma foto. Na verdade  fazem o reconhecimento facial. Com a biometria e os dados coletados da vítima  contratam empréstimos consignados sem a idosa perceber.      “Elas foram simpáticas. Hoje  quando eu vejo que eu caí na lábia delas  eu fico com raiva de mim mesmo”  conta a vítima.      Com base em imagens  a Polícia Civil identificou e prendeu as duas golpistas: Joyce Melo dos Santos e Denise Silveira Pinheiro. Na casa da Denise  os policiais encontraram um jaleco. Ela e Joyce foram reconhecidas por três vítimas  que ficaram no prejuízo.           “A Joyce já tinha esse histórico de estelionato e de crimes praticados no Sul. E a Denise  que foi solta  ela já respondia a um crime de estelionato contra a Caixa Econômica Federal  diz o delegado Américo dos Santos Neto.      O Fantástico não conseguiu contato com a defesa de Joyce e Denise.             Golpe da biometria: duas falsas agentes de saúde agem em São Bernardo do Campo  na Grande São Paulo Foto: Fantástico/ Reprodução     Golpe da biometria: duas falsas agentes de saúde agem em São Bernardo do Campo  na Grande São Paulo Foto: Fantástico/ Reprodução        Em nota  a Prefeitura de São Bernardo do Campo fez um alerta: Os agentes comunitários de saúde não realizam filmagens ou fotografias do rosto dos pacientes  nem solicitam impressões digitais durante as visitas  tampouco a coleta de qualquer dado biométrico.       A Polícia Civil continua a investigação e tenta identificar e prender outros quatro criminosos que aplicavam o golpe da biometria. Enquanto isso  muitas das vítimas ainda sofrem. Elas simplesmente não conseguem suspender os descontos mensais dos empréstimos consignados.            Em nota  a Febraban diz: Cada instituição financeira tem sua própria política de análise e devolução  que é baseada em análises individuais  considerando as evidências apresentadas pelos clientes e informações das transações realizadas.      Promessa de emprego      No Sul do Brasil  outras quadrilhas usaram o golpe da biometria para enganar pessoas que só queriam um emprego. As vítimas achavam que estavam sendo fotografadas para o cadastro da empresa  quando  na verdade  estavam assinando documentos eletronicamente.       Um morador de Florianópolis imaginava ter encontrado uma boa oportunidade de trabalho como motorista. A foto que o entrevistador tirou era uma biometria facial. Com a biometria e os dados coletados durante a entrevista  os golpistas financiaram um carro em nome da vítima no valor de quase R$ 69 mil.       A vítima conseguiu entrar em contato com o banco a tempo de suspender o financiamento. Os criminosos ainda não foram identificados  mas o golpe do falso emprego já fez vítimas em outros estados.       Em Guarapuava  no Paraná  Francielle Kretchemer recebeu uma proposta de emprego de uma suposta empresa de recursos humanos. Durante a entrevista de emprego  o golpista pediu para tirar uma foto dela. No dia seguinte  a surpresa: os golpistas haviam financiado um carro em nome da Francielle por R$ 170 mil.            Rafael Bueno Carneiro e Mateus Ramos de Carvalho foram presos em flagrante enquanto aplicavam o mesmo golpe em outra vítima.      “A gente acredita que um coletava os dados pessoais e biometria facial e repassava a esse segundo envolvido aqui da cidade  que já tentava a liberação dos financiamentos veiculares”  diz o delegado Ramon Galvão Zeferino.      O advogado de Mateus e Rafael disse  em nota  que nenhum valor eventual decorrente de atividades ilícitas foi auferido por eles e tampouco exerceram qualquer controle ou influência sobre as operações fraudulentas.       A polícia também indiciou os donos de duas revendedoras de carros que foram usadas para receber as transferências bancárias dos financiamentos.       Ouça os podcasts do Fantástico       ISSO É FANTÁSTICO                    O podcast Isso É Fantástico está disponível no g1 e nos principais aplicativos de podcasts  trazendo grandes reportagens  investigações e histórias fascinantes em podcast com o selo de jornalismo do Fantástico: profundidade  contexto e informação. Siga  curta ou assine o Isso É Fantástico no seu tocador de podcasts favorito. Todo domingo tem um episódio novo.        PRAZER  RENATA               O podcast Prazer  Renata está disponível no g1 e nos principais aplicativos de podcasts. Siga  assine e curta o Prazer  Renata na sua plataforma preferida.        BICHOS NA ESCUTA                     O podcast Bichos Na Escuta está disponível no g1 e nos principais aplicativos de podcasts.|S|Golpe bancário
98|A partir desta sexta feira (30) aposentados e pensionistas do INSS que identificaram descontos associativos não autorizados em seus benefícios poderão buscar atendimento presencial em 4.730 agências dos Correios espalhadas por todo o Brasil.        A medida  resultado de uma parceria entre a Previdência Social e os Correios  busca oferecer um atendimento para quem enfrenta dificuldades com canais digitais. Nas agências  os segurados poderão:      Consultar se houve desconto não autorizado Solicitar contestação de cobranças Confirmar autorizações previamente dadas Acompanhar o resultado da contestação Avaliar e contestar documentos apresentados por associações Receber orientações impressas sobre como acessar os canais digitais.            Agência dos Correios Foto: Agência Gov     Agência dos Correios Foto: Agência Gov       Documentos e funcionamento           Para ser atendido  basta apresentar um documento oficial com foto. Não é necessário levar extrato bancário  comprovante de inscrição ou contracheque. Caso o beneficiário esteja impossibilitado de comparecer  um representante legal poderá ser atendido mediante procuração autenticada mas com acesso limitado apenas à consulta de informações.       O atendimento será gratuito  com prioridade para aposentados e pensionistas  e haverá filas preferenciais e guichês exclusivos em muitas unidades. A plataforma utilizada pelos Correios é independente da base de dados do INSS  garantindo a segurança das informações dos beneficiários.       Para encontrar a agência mais próxima  é possível consultar:      Site dos CorreiosCentral 135Link disponibilizado no portal do INSS                              INSS começa a devolver descontos indevidos de aposentados veja o calendário             E quem mora longe?      O governo também prevê ações itinerantes para alcançar localidades mais distantes  garantindo que ninguém fique sem atendimento.      Golpes      É importante lembrar que ninguém está autorizado a ir até a casa dos beneficiários em nome do INSS ou dos Correios. Em caso de dúvidas  os únicos canais seguros são:      Aplicativo Meu INSSSite meu.inss.gov.brCentral telefônica 135Agências dos Correios  a partir de 30 de maio     Devolução dos valores      O governo começou nesta segunda feira (26) a devolver os R$ 292 milhões retidos de forma indevida nas folhas de pagamento de abril. Os valores serão depositados automaticamente até o dia 6 de junho  junto com os benefícios mensais não é necessário solicitar o reembolso.        A devolução acontece após o INSS determinar a suspensão de todos os descontos associativos. Como a folha de abril já havia sido processada antes da decisão  os descontos foram feitos  mas os valores foram retidos e não chegaram às entidades.|S|Golpe bancário
99|Aumenta o número de golpes do falso advogado                Um levantamento da OAB mostrou que pelo menos 1600 pessoas foram vítimas do golpe do falso advogado em São Paulo em 2024. O estado lidera o ranking de denúncias  mas o crime tem se espalhado pelo país.       Como funciona o golpe do falso advogado?       O golpe geralmente começa com o acesso indevido a informações públicas de processos judiciais. Foi o que aconteceu com Nailde. Em entrevista ao Bom Dia Brasil  ela contou que criminosos se passaram por seu advogado e anunciaram o valor de uma ação que ela aguardava desde 2019.       Para receber precisava transferir via pix R$ 4 mil referentes ao imposto de renda. Só depois que o falso advogado parou de receber as mensagens ela percebeu que havia caído em um golpe.            Eles pegam fotos reais das redes sociais  logotipo do site uma alguma outra rede e tentam de alguma forma mostrar uma vantagem imediata para que o cliente caia no golpe  explicou o verdadeiro advogado da vítima.      Como se proteger?       Por conta do alto número de denúncias a OAB nacional lançou uma plataforma digital para confirmar a identidade de advogados de forma rápida e segura. Veja abaixo como funciona.       👉 O site é o ConfirmADV (confirmadv.oab.org.br).      Como fazer a pesquisa no ConfirmADV     Para fazer a pesquisa  basta colocar o número de inscrição na OAB  selecionar o estado e informar o e mail informado pelo suposto profissional.Em seguida  será enviada uma solicitação automática para o e mail do advogado  informando que um cliente deseja confirmar sua identidade.O profissional terá até 5 minutos para responder e confirmar os dados.Caso a confirmação seja feita dentro desse prazo  o cidadão receberá a autenticação validada do advogado.Se o tempo expirar sem resposta  tanto o cidadão quanto o advogado serão notificados de que a verificação não foi concluída.      O site faz parte de uma campanha de conscientização para orientar a população e evitar novas vítimas.      Canal de denúncias      Se a pessoa tiver sido vítima de uma tentativa de golpe ou feito um pagamento indevido  é possível fazer uma denúncia diretamente pelo canal oficial da OAB Nacional.             👉 O site para fazer denúncias é fiscalizacao.oab.org.br.|S|Golpe bancário
