|text|flg_crime|cat_crime
135|Homem tem prejuízo de R$ 55 mil após cair em golpe de falso leilão na internet Foto: Reprodução/TV Bahia     Homem tem prejuízo de R$ 55 mil após cair em golpe de falso leilão na internet Foto: Reprodução/TV Bahia                A Paraíba teve 406 registros de crimes de estelionato digital em 2022. Um aumento de 503 3% com relação a 2021  que terminou com um total de 67 ocorrências. Os dados são do Anuário Brasileiro de Segurança Pública  divulgados nesta quinta feira (20).        Conforme diz o código penal brasileiro  o estelionato digital é aplicar golpes  para obter alguma vantagem  na maioria das vezes em dinheiro  por meio das plataformas digitais.       O aumento de crimes de estelionato digital na Paraíba ficou atrás apenas de Roraima e Goiás  que foram  respectivamente  1155 1% e 1027 2%. Entre os estados do Nordeste  o que teve maior crescimento em crimes de estelionato digital  depois da Paraíba  foi Sergipe  com 437 1% de variação.             Segundo o advogado Inngo Iná  no estelionato digital  o criminoso consegue enganar alguém  por meio de redes sociais  telefone  e mail ou qualquer outro meio digital fraudulento  com o intuito de conseguir dados confidenciais  como  senhas de acesso  bancos ou número de cartão de crédito ou débito.       “Estelionato é manter alguém em erro  através de meio errado  com objetivo de obter vantagem  sobretudo financeira. A fraude nesse contexto é o meio para se obter a vantagem”  diz o advogado.       Um exemplo desse tipo de crime é quando golpistas ligam para as vítimas ou falam com elas pelas redes sociais  fingindo ser funcionário de alguma empresa  alegando que a pessoa tem uma dívida em seu nome.      Punição para crime de estelionato digital       O crime de estelionato digital é um agravante do crime de estelionato  após mudança em lei estabelecida em 2021  que alterou o código penal e incluiu fraude eletrônica  popularmente conhecida como estelionato digital  como uma forma qualificada do crime de estelionato  e por isso recebe pena mais severa.       Quem é julgado como culpado pelo crime comum de estelionato recebe pena de 1 a 5 anos de prisão. Porém  após a alteração na lei  com o agravante digital  a pena para essa tipificação é de 4 a 8 anos e pode ser aumentada em até 2/3  caso o crime seja cometido com uso de servidor (computador para armazenar dados) que esteja fora do Brasil.             Além disso  caso o estelionato digital seja cometido contra entidade pública a pena pode ser acrescida em 1/3.      Artigo em que o crime é previsto      Como agravante do estelionato  a fraude eletrônica passou a ser considerada no Código Penal Brasileiro no artigo 171 inciso segundo  que traz a tipificação do crime e também trouxe uma pena agravada para essa qualificação.      Vídeos mais assistidos do g1 Paraíba          50 vídeos|S|Golpe bancário
136|Golpistas se passaram pela advogada Gicielle Rodrigues para pedir dinheiro a clientes. Foto: Reprodução     Golpistas se passaram pela advogada Gicielle Rodrigues para pedir dinheiro a clientes. Foto: Reprodução               De repente  uma mensagem surge cobrando o pagamento de uma taxa para a liberação de valores fruto de uma ação judicial. A pessoa que recebe o contato já aguardava este valor há meses ou até anos  e  diante da chance de finalmente ser atendida  transfere os valores pedidos na mensagem. Apenas para  pouco tempo depois  descobrir que se tratava de um golpe.       Participe do canal do g1 AC no WhatsApp      Este é o chamado golpe do falso advogado que  em 2024  pode ter vitimado mais de 200 pessoas no Acre  segundo a Secretaria de Estado de Justiça e Segurança Pública (Sejusp). Além de prejudicar as vítimas financeiramente  o esquema também mancha a reputação de advogados  que precisam zelar por seus nomes para manter a clientela.            Uma das profissionais que tiveram os dados utilizados no golpe foi a advogada Gicielle Rodrigues  de Rio Branco. Ela conta que desde setembro do ano passado recebe mensagens de clientes desesperados após transferirem valores supostamente solicitados por seu escritório  mas através de números falsos.       Conforme a advogada  a situação continuou até o mês de março deste ano. Os clientes perderam entre R$ 300 e R$ 2 mil  valores que  muitas vezes  eram reservas mantidas com muito custo pelas vítimas.      LEIA MAIS:     Em ‘golpe da facção’  criminosos fazem ameaças e exigem até R$ 3 mil de vítimas saiba como se proteger‘Golpe das missões’: Três pessoas são presas no AC em operação contra esquema que prometia ganhos financeirosAcreanos acusam agências de turismo de supostos golpes na compra de pacotes de viagens empresa nega      Gicielle registrou boletins de ocorrência e comunicou os casos á Ordem dos Advogados do Brasil Seccional Acre (OAB AC) para alertar sobre a situação.      “Clientes começaram a me ligar em desespero  chorando  após realizarem pagamentos a estelionatários  acreditando que estavam lidando comigo. São pessoas que enfrentavam dificuldades financeiras  algumas juntando economias com sacrifício  outras pedindo dinheiro emprestado na esperança de resolver suas pendências judiciais. Uma das clientes  viúva e mãe de dois filhos  me ligou desesperada porque tinha usado parte do dinheiro destinado às despesas básicas mensais da família. Outra  idosa e aposentada  acreditou que finalmente receberia um valor que aguardava e pagou para os golpistas  e posteriormente descobriu que foi enganada”  relata.          Audiência pública            Audiência debateu combate ao golpe do falso advogado. Foto: Sérgio Vale/Aleac     Audiência debateu combate ao golpe do falso advogado. Foto: Sérgio Vale/Aleac        Diante do número cada vez maior de relatos semelhantes  a OAB AC articulou  junto à Assembleia Legislativa do Acre (Aleac) uma audiência pública para debater o problema e discutir possíveis soluções. A reunião  promovida na sexta feira (28)  contou com a participação de advogados  forças de segurança e parlamentares.       Durante a audiência  o delegado Fabrizzio Sobreira  representante da Sejusp no encontro  explicou que o número de notificações de possíveis vítimas do golpe do falso advogado tem crescido a níveis preocupantes desde 2018  quando foram nove casos. Já em 2023 a quantidade subiu para 140 ocorrências  chegando a 245 ocorrências no ano passado.            Somente nos primeiros três meses de 2025  ainda segundo o delegado  foram 113 registros.       “A Polícia Civil tem trabalhado de forma intensa para mapear e combater essas práticas criminosas  mas é fundamental que haja uma integração maior entre os poderes e as forças de segurança. O crime cibernético não tem fronteiras  e precisamos estar à altura desse desafio para proteger advogados  operadores do direito e a sociedade como um todo”  alegou.       Também participou da audiência  como presidente da OAB  a advogada Thais Moura  que enfatizou a necessidade de integração entre vários órgãos para diminuir a ocorrência de golpes desse tipo.      “Precisamos pensar em medidas concretas  seja unificando a investigação desses crimes com a Delegacia de Combate aos Crimes Cibernéticos  seja estabelecendo procedimentos no Tribunal de Justiça para rastrear acessos a documentos  ou ainda promovendo reuniões com operadoras de telefonia e instituições bancárias para criar diretrizes eficazes”  disse.      Conforme a OAB AC  a audiência pública firmou compromisso para a criação de um comitê interinstitucional de enfrentamento aos golpes digitais e crimes cibernéticos  que vai buscar mecanismos para fortalecer o enfrentamento ao estelionato em âmbito digital.      Atenção redobrada            Esquema tenta reproduzir linguagem de advogados em conversas com clientes em tentativa de golpe. Foto: Reprodução     Esquema tenta reproduzir linguagem de advogados em conversas com clientes em tentativa de golpe. Foto: Reprodução            “Esses relatos me deixaram profundamente indignada e sensibilizada  pois mostram como a credibilidade da advocacia está sendo explorada de forma criminosa para prejudicar justamente aqueles que mais precisam de justiça. Essas pessoas não perderam apenas dinheiro perderam a tranquilidade  o planejamento financeiro e  em muitos casos  comprometeram suas necessidades básicas por conta do golpe. Essa dor  não pode ser ignorada. É por isso que essa luta não é apenas pela advocacia  mas principalmente pela proteção da sociedade”      Enquanto as soluções são discutidas  a advogada Gicielle ressalta que o público deve sempre desconfiar de mensagens  principalmente as que pedem a transferência de valores.       “Sempre verifique a identidade do advogado antes de realizar qualquer pagamento. Essa consulta pode ser feita diretamente no site da OAB  onde é possível confirmar se o profissional está devidamente registrado e regularizado. Sempre buscar contato direto com o advogado responsável pelo caso  de preferência  por canais oficiais  como telefone ou endereço do escritório. Para maior segurança  recomenda se até mesmo uma videochamada com o advogado”  alerta.       Caso seja constatado o pagamento de valores a golpistas  é recomendado o registro de boletim de ocorrência. Também podem ajudar na apuração capturas de tela das conversas. A advogada ressalta ainda que é preciso desconfiar de qualquer solicitação de pagamento antecipado para a liberação de valores judiciais  já que alvarás e sentenças são expedidos pelo Judiciário e não dependem de taxas cobradas por advogados.            “A realização da audiência pública foi um grande passo  pois conseguimos reunir diversas autoridades para discutir o problema e buscar soluções concretas. A criação de um comitê especializado é uma das propostas mais eficazes para monitorar e coibir esse tipo de crime. Além disso  reforçamos a importância de campanhas de conscientização para que a população saiba identificar e denunciar golpes”  acrescenta.                               Golpe da CNH: como se proteger de mensagens falsas sobre suspensão da habilitação                     Reveja os telejornais do Acre          50 vídeos|S|Golpe bancário
137|Trânsito Cuiabá Foto: Luiz Alves     Trânsito Cuiabá Foto: Luiz Alves                A Polícia Civil alerta para um golpe envolvendo boletos falsos do Imposto sobre a Propriedade de Veículos Automotores (IPVA)  que já fez pelo menos nove vítimas em Mato Grosso. Criminosos utilizam sites fraudulentos para enganar os contribuintes  gerando cobranças indevidas e desviando os valores pagos.        ✅ Clique aqui para seguir o canal do g1 MT no WhatsApp       Como funciona esse golpe:      Criminosos enviam mensagens por SMS  WhatsApp e e mails com links falsos que direcionam as vítimas para páginas semelhantes às oficiais As páginas simulam o ambiente digital da Secretaria de Estado de Fazenda (Sefaz MT) Vítimas são induzidas a realizarem pagamentos via PIX ou boletos bancários Pagamentos são desviados para contas de estelionatários.           Outro golpe      Outro método utilizado pelos golpistas envolve a criação de sites falsos que aparecem nas primeiras posições de buscas em mecanismos como o Google. As vítimas  acreditando estar no portal oficial da Sefaz MT devido à aparência semelhante  acabam sendo enganadas e realizam pagamentos indevidos.       O delegado Pablo Carneiro  da Delegacia de Estelionato de Cuiabá  disse que casos recentes foram registrados pela Polícia Civil.      “Uma vítima em Cuiabá  efetuou o pagamento do IPVA via Pix após acessar um site fraudulento encontrado em pesquisa na internet. O valor pago  que a vítima acreditava ter sido direcionado à Secretaria de Fazenda  acabou caindo em uma conta particular vinculada a estelionatários”  disse o delegado.     📱Dicas para evitar esse tipo de crime      Devido o golpe ter sido registrado com frequência em Mato Grosso  a Polícia Civil reuniu algumas orientações para que os cidadãos evitem serem vítimas desse golpe  veja abaixo:      Realizar o pagamento do IPVA somente pelo site oficial da Secretaria de Estado de Fazenda Evitar clicar em links recebidos por SMS  aplicativos de mensagens ou e mails  mesmo que prometam descontos ou facilidades para o pagamento Não realizar buscas aleatórias para acessar o site do IPVA  utilize sempre o endereço oficial da Sefaz MT.Conferir com atenção os dados bancários e o nome do beneficiário antes de confirmar qualquer pagamento.Em caso de suspeita de golpe ou fraude  registre imediatamente um boletim de ocorrência na delegacia mais próxima ou pela Delegacia Digital.            ✅ Clique aqui para seguir o canal do g1 MT no WhatsApp                              Polícia Civil faz alerta sobre golpe do falso IPVA|S|Fraude
138|Polícia prende irmãos suspeitos de aplicar golpe do PIX em empresas de Salto e Sorocaba (SP) Foto: Divulgação     Polícia prende irmãos suspeitos de aplicar golpe do PIX em empresas de Salto e Sorocaba (SP) Foto: Divulgação               Policiais civis do Departamento Estadual de Investigações Criminais (Deic) prenderam  na quinta feira (9)  dois irmãos suspeitos de aplicar golpes envolvendo transações por PIX. Os dois foram detidos em condomínios de luxo em Sorocaba e Salto (SP).        Com os suspeitos  as equipes da 6ª Delegacia Patrimônio (DP) apreenderam documentos e artigos de luxo  entre eles máquinas de cartão  celulares  computadores  joias e dois veículos importados.Polícia prende irmãos suspeitos de aplicar golpe do PIX em empresas de Salto e Sorocaba (SP) Foto: Divulgação     Polícia prende irmãos suspeitos de aplicar golpe do PIX em empresas de Salto e Sorocaba (SP) Foto: Divulgação             De acordo com a polícia  os irmãos criaram uma estratégia que possibilitou dobrar o valor subtraído dependendo do tipo de operação realizada utilizando o sistema.       Ainda segundo o Deic  o esquema funcionava desde o início de 2021 e os principais alvos eram instituições financeiras  como bancos digitais. Os suspeitos foram autuados por associação criminosa e levados para São Paulo.             Suspeitos foram detidos em condomínios de luxo em Sorocaba e Salto (SP) Foto: Divulgação     Suspeitos foram detidos em condomínios de luxo em Sorocaba e Salto (SP) Foto: Divulgação                    VÍDEOS: assista às reportagens da TV TEM         50 vídeos             Veja mais notícias da região no G1 Sorocaba e Jundiaí|S|cibercrime
139|Influenciador digital é preso após dirigir embriagado e motociclista morrer após batida                O influenciador digital Enzo Santana Machado foi preso na madrugada desta segunda feira (26)  em Salvador  após atropelar e matar um motociclista por aplicativo. De acordo com informações apuradas pela TV Bahia  o suspeito não tem carteira de habilitação e dirigia embriagado.        O advogado do influenciador  Otto Lopes  disse  em entrevista à TV Bahia  que Enzo Machado não estava alcoolizado no momento do acidente.       Foi lavrado um auto de prisão de flagrante pela autoridade policial  que em momento algum tipificou nesta conduta. Ele fez o teste do bafômetro  teste de sangue  mas não tem nenhuma comprovação até o presente momento nos autos de que ele estivesse bebendo  disse.            Ainda segundo o advogado  após o acidente  o influenciador teria ido à delegacia para pedir socorro para ele e para o motociclista. Otto afirmou que o cliente ficou preso pelo fato de não ter Carteira Nacional de Habilitação (CNH).             Influenciador digital foi preso em flagrante em Salvador Foto: Redes sociais     Influenciador digital foi preso em flagrante em Salvador Foto: Redes sociais        A vítima tinha 41 anos e foi identificada como Uzias Cardoso de Souza. Ele pilotava a motocicleta no bairro de Matatu de Brotas  quando o carro do influenciador bateu de frente com o veículo. Uzias estava trabalhando no momento do acidente e morreu no local.       De acordo com a família  Uzias trabalhou ao longo do domingo e deu um pausa nas corridas para celebrar o aniversário de 95 anos da avó. O acidente ocorreu por volta de 00h  quando ele já encerrava o expediente.           Meu filho foi abraçar a avó dele  que fez 96 anos. Eu liguei para ele e pedi que ele voltasse para casa  pois tive um pressentimento. Ele me disse que já voltaria para casa  contou a mãe de Uzias.       O motociclista deixou dois filhos  de 18 e 16 anos. Além disso  ele criava sete sobrinhos junto com a esposa  após a irmã dele ser vítima de um feminicídio e outro familiar morrer na pandemia da Covid 19.       O influenciador Enzo Santana Machado foi preso em flagrante e levado para a delegacia  onde permanece na manhã desta segunda feira.       Enzo tem 168 mil seguidores em apenas uma rede social. Ele é marido da também influenciadora Radija Pereira  que tem 3 milhões de seguidores. Após o caso  ambos fecharam os perfis nas redes sociais.       Segundo informações apuradas pela TV Bahia  o influenciador havia passado o domingo no Barradão  onde assistiu ao jogo do Vitória contra o Santos. Após o jogo  ele saiu do local de carro e alcoolizado.       LEIA TAMBÉM:      VÍDEO: Kevi Jonny fura bloqueio do DNIT e passa de moto por ponte interditada na BahiaDavi Brito revela vício em álcool: Só me afastava de quem eu queria serCantor e compositor baiano Wilson Aragão morre aos 75 anos           Veja mais notícias do estado no g1 Bahia.      Assista aos vídeos do g1 e TV Bahia 💻          36 vídeos|S|Golpe bancário
140|Cinco pessoas foram presas suspeitas de estelionato e organização criminosa na Bahia                Cinco pessoas foram presas em flagrante por suspeita de aplicar o golpe do falso consórcio de imóveis em Salvador. De acordo com a Polícia Civil  as prisões ocorreram na terça feira (25)  após a denúncia de um influenciador digital que foi vítima do golpe. Ele comprou um apartamento que nunca foi entregue. [Saiba mais sobre o modus operandi dos suspeitos ao final da matéria]        A empresa já era monitorada pela Delegacia de Defesa do Consumidor há meses e mais de 200 ocorrências já foram registradas contra eles. O prejuízo das vítimas varia entre R$ 5 mil e R$ 1 milhão.       O influenciador  que não quis ser identificado  contou para a polícia que mantinha contato com a dona da empresa há cerca de um ano. Neste período  foram feitas visitas a imóveis e repasses financeiros. Porém  ele não recebeu nenhuma documentação do suposto imóvel adquirido.             Após a denúncia  a polícia foi até o escritório  localizado no bairro do Itaigara  onde a dona da empresa e outros 10 colaboradores foram conduzidos até a delegacia.       Apesar disso  apenas cinco deles foram presos por suspeita de propaganda enganosa  estelionato e organização criminosa. Há também indícios de que o grupo praticou lavagem de dinheiro.       Três desses cinco suspeitos tiveram a prisão convertida em preventiva após audiência de custódia. Para as outras duas pessoas  a Justiça determinou a liberdade  porém com medidas cautelares  como comparecer em juízo mensalmente e proibição de trabalhar com intermediação financeira.       No local foram apreendidos:      R$ 17 mil em dinheiro R$ 1 mil em dinheiro2 pen drives1 automóvel Ecosport1 automóvel T CrossCaixa contendo diversos contratos de consultoria financeiraDiversos cadernos de anotações14 carregadores de notebook07 celulares15 notebooks3 máquinas de cartão de crédito11 CPUs     Modus operandi            Imóvel supostamente comprado pelo influenciador digital em Salvador Foto: Arquivo pessoal     Imóvel supostamente comprado pelo influenciador digital em Salvador Foto: Arquivo pessoal             O influenciador digital entrou em contato com a empresa no final de 2023  após buscas por imóveis na internet. Ele já era proprietário de um imóvel na capital baiana  mas gostaria de se mudar para um apartamento mais confortável.       O primeiro contato com os funcionários da empresa foi por um aplicativo de mensagens. Ele foi convidado a conhecer a sede da empresa  no Itaigara  e a visitar dois apartamentos  localizados na Boca do Rio e no Imbuí.      Eu visitei o apartamento  fechei negócio e dei entrada. Comecei a desconfiar porque o imóvel não era liberado  a chave nunca era entregue  sendo que já estava praticamente quitado  contou.      O imóvel escolhido fica na Boca do Rio e tem piscina  churrasqueira e área gourmet. O influenciador não sabe se vai conseguir ressarcir o valor pago pelo apartamento.       A vendedora ambulante Jacilene  relatou  em entrevista à TV Bahia  que teve um prejuízo de R$ 42 mil há cerca de um ano  e tentou comprar um imóvel no bairro do 2 de Julho.      Depois que paguei R$ 31 mil  ela me ligou marcando comigo para dar o restante do dinheiro e que eu iria ver o imóvel. Quando chegou lá  foi outra pessoa que me atendeu  já não foi mais ela. Aí eu não vi o imóvel. Eu tenho todos os comprovantes. Eles disseram que eu teria que dar mais dinheiro para conseguir o imóvel  relatou a mulher.            Jacilene disse que  quando percebeu que caiu em um golpe  prestou um boletim de ocorrência. Mesmo assim  segundo ela  eles continuaram pedindo dinheiro.             Imóvel tinha churrasqueira e área gourmet Foto: Arquivo pessoal     Imóvel tinha churrasqueira e área gourmet Foto: Arquivo pessoal        Outros clientes vítimas do golpe foram enganados com o mesmo modus operandi:       👉 O grupo agia cooptando clientes pela internet  através de sites e plataformas de vendas virtuais  oferecendo imóveis que não existiam.       👉 Quem se interessava pelos imóveis  era convidado a ir até a sede da empresa. Lá  os suspeitos davam orientações sobre a compra.       👉 As vítimas também visitavam os supostos imóveis e realizavam repasses financeiros  sem nunca receberem comprovação de documentos que confirmassem a negociação do bem.            👉 O grupo criminoso era estruturado e hierarquizado  com foco na prática de crimes de estelionato contra consumidores.       👉 De acordo com o influenciador  o grupo criminoso também simulava contatos com o banco.                               Golpistas fazem 120 vítimas com venda de imóveis e veículos         Veja mais notícias do estado no g1 Bahia.      Assista aos vídeos do g1 e TV Bahia 💻         45 vídeos|S|Golpe bancário
