|index|text|flg_crime|cat_crime
49|49|"De acordo com o delegado Tiago Baldin, chamou a atenção da polícia, a frieza e tranquilidade dos golpistas.
""Eles passam uma falsa impressão, passam a aparência de licitude, aquela conduta, porque a vítima se sente respaldada.""
Polícia cumpre mandados judiciais durante operação no Rio Grande do Sul — Foto: Fábio Almeida/RBS TV
Em uma das ligações, a vítima é indagada sobre uma compra (falsa) feita com o cartão de crédito dela. Ela nega. Em seguida, o integrante da quadrilha afirma que a pessoa foi vítima de clonagem, e passa falsas orientações, dizendo até que existiria uma parceria com a Polícia Civil para investigar as fraudes.
Em seguida, o golpista faz que encaminha a ligação para uma central de bloqueio. Nesse momento, pede que a pessoa digite a senha pelo teclado telefônico, permitindo a interceptação, e depois orientam o cliente a cortar o cartão no meio, com uma tesoura, mas tendo o cuidade de deixar o chip intacto. Depois, um motoboy é enviado ao endereço para pegar o cartão, que seria usado para compras, saques e empréstimos.
""Boa tarde, meu nome é ***, eu falo da central de segurança dos cartões Visa e Mastercard"", diz o golpista na ligação, informando a vítima sobre uma compra no valor de R$ 2,5 mil. ""Não, eu não estou comprando nada"", responde a dona do cartão.
""Infelizmente, a nossa suspeita se confirma. Possivelmente a senhora foi vítima de uma clonagem de cartão de crédito"", continua o golpista. Ele informa que a compra foi bloqueada, e que a empresa trabalha em conjunto com a polícia para identificar a origem da fraude.
""Vamos ter que fazer a investigação, juntamente com a Polícia Civil, uma parceria que nós temos em Porto Alegre, para saber e localizar de onde partiu a clonagem do cartão da senhora"", diz o falso atendente.
Então ele transfere a ligação para uma falsa central de cancelamento, onde toca até uma música comum de espera de serviços de atendimento telefônico. Em seguida, o criminoso diz à vítima que a empresa vai ajudá-la a registrar um boletim de ocorrência.
""Eu vou lhe ditar uma carta, na qual a senhora vai escrever, uma carta bem simples. Ela apenas servirá de boletim de ocorrência para a senhora não ter que se deslocar até uma delegacia nem a nossa central de segurança"", diz o golpista, ainda na ligação.
""A senhora vai cortar ele [cartão] ao meio, na vertical, mas o chip, que é aquela parte prateada dele, não poderá ser danificado, porque é através deste chip que nós vamos conseguir saber e localizar de onde partiu a clonagem do cartão da senhora"", continua.
Em seguida, o golpista orienta a vítima sobre uma pessoa que vai retirar a documentação na residência dela.
Por meio de nota, a Mastercard informou que ""não telefona ou envia e-mail aos portadores de cartão para falar a respeito de transações. O contato com o consumidor a respeito de possíveis fraudes poderá ser feito pela instituição financeira que emite o cartão, não pela bandeira. Portanto, qualquer ligação com esse propósito que utilize o nome da Mastercard deve ser desconsiderada"". A assessoria da Visa ainda não atendeu.
29 vítimas identificadas
Operação desarticula quadrilha que usa central telefônica para roubar dados de cartões
Durante a investigação, a polícia identificou que 29 pessoas foram vítimas do golpe, que pode chegar a R$ 422 mil. A quadrilha fica em São Paulo, onde mantém a central telefônica, mas os integrantes se deslocam até o Rio Grande do Sul após ter acesso às senhas e aos chips.
O delegado Baldin afirma que os golpistas faziam as compras em Porto Alegre para evitar desconfianças. ""Eles vêm e utilizam aqui em Porto Alegre, porque chamaria muito a atenção aqueles cartões de crédito sendo utilizados em grande escala em uma unidade da federação, que não a de origem.""
De acordo comBaldin, chamou a atenção da polícia a frieza e tranquilidade dos golpistas. ""Eles obviamente possuem dados cadastrais das pessoas, e eles buscam alvos que entendem que sejam mais fáceis. Pessoas de mais idade, que ficam em suas residências no período da manhã ou da tarde"", acrescenta.
Ainda conforme o delegado, os suspeitos ligavam sempre para telefones fixos, e não deixavam a linha cair quando pediam para a vítima ligar para a administradora de cartão de crédito, conforme o número no verso do cartão, para solicitar o cancelamento.
""Mas como a vítima está utilizando um telefone fixo, o estelionatário não desligou, ele está com a linha trancada. Quando a vítima baixa o telefone no gancho, e liga novamente, o estelionatário lança uma gravação que dá o sinal de linha para efetuar nova ligação. A vítima faz a ligação, e quando termina de discar, o estelionatário já lança uma nova gravação de rotina, como se liga para uma operadora"", explica o delegado."|S|Golpe bancário
50|50|"Segundo a 14ª DP (Leblon), Ingrid Caroline Borges Gonçalves, de 20 anos, que é de Dracena, São Paulo, tentava pagar a estadia em um apartamento de temporada no Leblon com cartões de crédito clonados.
Compartilhe esta notícia no WhatsApp
Compartilhe esta notícia no Telegram
Ingrid Caroline possui 188 mil seguidores em uma rede social. Em seu perfil, são comuns postagens em viagens por diferentes estados do Brasil, em pontos turísticos.
Em seu perfil, ela se descreve como “figura pública” e afirma: “Bem-vindo seja aquele que veio por bem”.
Influencer diz que foi vítima de golpe
Na tarde desta terça-feira (25), a influencer manifestou-se por meio de nota enviada por seu advogado.
Lucas França Bressanin, que representa Ingrid, informou que sua cliente foi vítima de um golpe e que vem colaborando com as autoridades para solucionar o crime.
“Em meados de julho de 2021, a influencer foi abordada través da mídia social Instagram pelo IG @grupo.maisx onde, na oportunidade, o interlocutor se apresentou como uma agência de viagens e propôs uma parceria para divulgação da respectiva empresa onde, em troca, a influencer receberia passagens e hospedagens gratuitas e/ou descontos”, diz trecho do documento enviado pelo advogado.
“Com a parceria firmada, a influencer passou a divulgar em suas mídias sociais o @grupo.maisx, que exigiu todos os seus dados pessoais para que assim pudesse disponibilizar as referidas passagens e hospedagens em pagamento ao serviço de divulgação. De forma criminosa, premeditada e ardilosa, o estelionatário ao conquistar a confiança da vítima e estando em posse de todo seus dados pessoais, efetuou a clonagem de um cartão de crédito, que foi utilizado pelo malfeitor de forma on-line e sem o conhecimento da mesma"", explica.
""De forma colaborativa, a vítima apresentou as autoridades inúmeras provas e relatos que demonstram indubitavelmente as tratativas, o acordo de prestação de serviço de divulgação entabulado entre as partes e que forneceu todos seus dados para a respectiva empresa, que lhes utilizou de forma ilícita, efetuando a clonagem do cartão de crédito que passou a ser utilizado sem qualquer autorização/conhecimento"", diz na parte final do documento.
(ATUALIZAÇÃO: após a prisão, ela foi solta sob fiança e, segundo a polícia, fechou acordo com a vítima, que retirou a queixa. A reportagem foi atualizada às 16h35 de 14/02/2022.)
Ingrid Caroline, estudante de direito — Foto: Reprodução
Ingrid Caroline, estudante de direito e influencer — Foto: Reprodução
Ingrid Caroline, estudante de direito — Foto: Reprodução"|S|Fraude
51|51|"Como o nome do investigado não foi divulgado, a reportagem não conseguiu localizar a defesa dele.
A prisão aconteceu na segunda-feira (3). Uma vítima contou que percebeu na fatura do cartão algumas compras de perfumes importados no valor de R$ 800, que não havia feito. Ela entrou em contato com os estabelecimentos para entender o que poderia ter acontecido. Ao suspeitar de uma fraude, ela entrou em contato com a polícia, que deslocou até o local do fato.
""Entrei em contato com a primeira loja, me identifiquei e disse que havia ocorrido uma fraude, e eles me atenderam e me passaram o endereço de onde seria a entrega, o nome do comprador. Eu estava ao lado de um policial militar. De pronto, ele acionou a equipe dele e se deslocou até o local do fato"", pontua a vítima.
A mulher lesada afirma que, na casa do suspeito, havia inúmeros produtos. ""Eles chegaram no local e encontraram outras mercadorias também, um total assim, por cima, de mais de R$ 20 mil em mercadorias que foram compradas, segundo o autor, de forma ilícita"", relata.
Segundo a PM, o homem disse que conseguiu os dados das vítimas pela pela internet. Ele foi encaminhado para a Central de Flagrantes da Polícia Civil, que deve investigar o caso.
Polícia encontra R$ 20 mil em mercadoria com homem preso suspeito de clonar cartão, em Goiânia, Goiás. — Foto: Reprodução/TV Anhanguera
Veja outras notícias da região no G1 Goiás.
Pelo menos 20 mil reais em mercadorias estava com ele nessa casa
Um homem foi preso pela Polícia Militar, em Goiânia, após
Tinha perfumes importados, produtos eletrônicos, celulares, carregadores, notebooks, bebidas, roupas
Uma das vítimas que teve o cartão clonado estranhou uma das compras feitas feitas pela internet no valor de R$ 800 em uma loja de perfumes importados e entrou em contato com a loja para entender que compra tinha sido essa. A funcionária da loja informou o endereço que seria entregue essa mercadoria, disse inclusive que o entregador estava saindo para fazer a entrega. Com base nessas informações, a vítima chamou a polícia. A polícia foi junto com o entregador. Qdo o entregador fez a entrega, a polícia fez a abordagem e quem recebeu a compra nao fez a compra, apenas estava recendo o produto, a pessoa nao estava em casa.
A polícia descobriu o endereço de quem fez a compra e viu as mercadorias
""Por volta das 14h, vi na fatura do meu cartão que haviam compras no meu cartão que não tinham sido feitas por mim. Entrei em contato com a loja, com a primeira loja, me identifiquei, que havia ocorrido uma fraude e eles me atenderam e me passaram o endereço de onde seria a entrega, o nome. Eu estava ao lado de um policial militar, de pronto ele acionou a equipe dele, e eles deslocaram até o local do fato. Eles chegaram no local e encontraram outras mercadorias também, um total assim, por cima, mais de 20 mil mercadorias que foram compras, segundo o autor, de forma ilícita"".
A polícia quis saber como esse estelionatário conseguiu essas informações. Ele disse a polícia que essas informações ele conseguiu por meio das redes sociais. O caso foi encaminhado para a Central de Flagrantes e a PC vai investigar o caso"|S|Fraude
52|52|"Conforme apurado pela 1ª Delegacia Territorial (DT/Barris), o prejuízo foi de R$ 3.710,82 com a compra de um iPhone 12 Pro. O aparelho foi entregue em São Sebastião do Passé, na Região Metropolitana de Salvador (RMS).
Durante a investigação da Polícia Civil, foi identificado que a responsável pelo recebimento era a avó do suspeito. Ao ser abordada, ela confirmou que o neto havia efetuado a compra ilícita.
Com isso, a equipe da 37ª DT/São Sebastião do Passé localizou o suspeito na Av. Professor Magalhães Neto, no bairro do Caminho das Árvores, área nobre da capital baiana. Ele estava com o celular.
O suspeito, então, foi autuado e encaminhado à unidade policial, onde permanecerá à disposição da Justiça.
LEIA TAMBÉM
Homem é preso em flagrante por estelionato; suspeito tem outras 16 passagens pela Polícia na Bahia
Homem é preso suspeito de clonar cartões e fazer compras em posto de combustíveis na Bahia; prejuízo foi de R$ 40 mil
Cinco pessoas são presas durante operação da PF que investiga empréstimos fraudulentos na Bahia e Sergipe
Veja mais notícias do estado no g1 Bahia.
Reproduzir vídeo
Suspeito de estelionato é preso em resort de luxo na Bahia
Assista aos vídeos do g1 e TV Bahia 💻
50 vídeos"|S|Fraude
53|53|"Se você sofreu esse tipo de golpe, pode acionar o WhatsApp para tentar normalizar a situação. Em alguns casos, a recuperação da conta pode levar alguns dias. Por isso, também é importante alertar seus contatos que alguém está se passando por você.
Confira dois tipos bastante conhecidos de golpes de WhatsApp e veja em seguida o que fazer em cada caso.
Clonagem de conta (ou ""golpe do número novo""): alguém tem acesso à sua foto e aos seus contatos e, então, cria uma conta para se passar por você e pedir dinheiro para seus amigos e familiares;
Roubo de conta: alguém entra em contato com você se passando por uma empresa e pede o código enviado por SMS sob alegação de que ele seria usado para confirmar um cadastro, mas, na verdade, a informação é usada para transferir sua conta para outro celular.
WhatsApp clonado: o que fazer?
No caso de WhatsApp clonado, as únicas medidas a serem tomadas são alertar seus contatos sobre o golpe e pedir para eles denunciarem a conta fraudulenta. Dê as seguintes orientações aos seus contatos:
Desconfie de mensagens atípicas;
Desconfie se alguém com sua foto enviar uma mensagem por um número desconhecido;
Se um número com a foto de um conhecido pediu dinheiro pelo aplicativo, tente ligar ou conversar pessoalmente com a pessoa para confirmar o pedido.
Como denunciar conta
Na tela da conversa, clique nos três pontinhos (⋮);
Clique ""Mais"" e, em seguida em ""Denunciar"";
Escolha se você quer bloquear o contato e apagar a conversa – esta opção fica ativada por padrão, por isso, considere tirar prints das mensagens antes de confirmar o bloqueio;
Selecione ""Denunciar"";
Informe por que o número está sendo bloqueado, como ""conteúdo indesejado"" – se você não optar por bloquear o contato, esta tela não será exibida.
Denunciar contato no WhatsApp — Foto: Arte/g1
Celular roubado, furtado ou perdido: passo a passo do que fazer
WhatsApp roubado: o que fazer?
Se a sua conta do WhatsApp foi roubada, é preciso voltar a configurá-la em seu celular. O processo pode levar alguns dias e inclui uma orientação importante: não peça para a operadora bloquear sua linha se você ainda receber ligações e mensagens em seu número.
Algumas pessoas imaginam que a medida também impede o acesso de invasores, mas, na verdade, ela dificulta a recuperação da conta. Isso porque o cancelamento da linha na operadora não afeta o funcionamento do WhatsApp.
Como recuperar o acesso à conta do WhatsApp.
Tente configurar a sua conta novamente no seu celular;
Insira o código de seis dígitos enviado para o seu número por SMS;
Se o golpista ativou uma segunda senha no outro celular – o que costuma acontecer –, é preciso aguardar sete dias e repetir o processo.
Segundo o WhatsApp, ainda que você não saiba o segundo código da proteção dupla, a pessoa que estava usando a sua conta será desconectada quando você inserir o código de seis dígitos enviado por SMS depois de sete dias da primeira tentativa.
Como proteger o WhatsApp em caso de roubo ou perda do celular
WhatsApp — Foto: Reuters/Francis Mascarenhas
Como prevenir golpes
Além de denunciar o número desconhecido, há outras medidas para prevenir que suas informações sejam acessadas por terceiros.
Elas podem ser realizadas ao acessar as ""Configurações"" – no Android, é preciso selecionar antes os três pontinhos (⋮) que aparecem no topo da tela inicial – e, em seguida, clicar em ""Privacidade"" e ""Segurança"". As duas páginas permitem:
Ativar a proteção em duas etapas, o que impede terceiros de roubarem seu perfil apenas com o código enviado por SMS;
Habilitar as ""Notificações de segurança"", que mostram quando uma pessoa configurou a conta dela em um novo celular – se alguém pedir dinheiro logo após este aviso aparecer, pode ser um sinal de golpe;
Controlar quem poderá ver sua foto de perfil – criminosos podem usá-la para se passar por você em outra conta no aplicativo; por isso, a recomendação é mostrar a sua foto apenas para seus contatos;
Limitar quem vê dados como ""visto por último"", ""online"" e status – para ter mais proteção, escolha mostrar esses dados somente para seus contatos em cada um;
Definir quem pode te adicionar em grupos – para não cair em grupos de desconhecidos, escolha limitar este recurso para os seus contatos;
Silenciar chamadas de números desconhecidos – elas ainda aparecerão na aba Chamadas e nas notificações.
O que fazer se seu celular for roubado
Reproduzir vídeo
VÍDEO: Saiba o que fazer se seu celular for roubado"|S|Cybercrime
54|54|"Durante a operação, realizada na quarta-feira (23), foram apreendidos um videogame e um aparelho celular avaliados em, aproximadamente, R$ 9 mil, além de uma pequena quantidade de entorpecentes.
O suspeito de 26 anos responderá pelos crimes de furto qualificado, uso de documento falso e associação criminosa.
A ação envolveu a Delegacia de Furtos e Roubos de Poços de Caldas, a polícias Civil e Militar de São Paulo e o Canil da Guarda Municipal de Vargem Grande do Sul e faz parte de uma investigação que apura a atuação do grupo em golpes aplicados contra estabelecimentos comerciais.
Esta foi a quarta prisão realizada. A polícia já identificou duas mulheres, de 26 e 27 anos, e um homem de 20 anos, também integrantes do grupo. Eles foram presos em flagrante em março pelos crimes de furto qualificado e associação criminosa e já foram soltos.
Segundo a polícia, a quadrilha causou prejuízos significativos a, pelo menos, duas lojas em Poços de Caldas. Até o momento, a Polícia Civil recuperou R$ 25 mil em produtos, entre eles celulares e videogames.
Veja mais notícias da região no g1 Sul de Minas"|S|Outros
55|55|"“Comprei biquíni na internet com o cartão do meu marido e daqui a pouco chega o dono do cartão esbaforido do nada: ‘Estou achando que clonaram meu cartão e foram em um *** [casa de prostituição]. Gastaram meu cartão numa tal de Garota de Luxo, em Anápolis’”, contou a cliente Ked Souza no post.
Compartilhe no WhatsApp
Compartilhe no Telegram
Em seguida, a mulher completou dizendo que teve a “crise do ano”. O post foi feito na sexta-feira (14) e, até as 20h desta segunda-feira (17), já reunia mais de 41 mil curtidas e mais de 1,4 mil compartilhamentos.
LEIA TAMBÉM:
‘Não arranque a porta do meu freezer’: Jovem faz convite de aniversário com manual de instruções e viraliza na internet
'Deus, me tira dessa': Advogado viraliza na web ao compartilhar perrengue com ex-namorada
Empresária viraliza na web após fazer campanha e comprar carro em menos de 24h para jardineiro que teve veículo queimado
Dono da loja, o empresário Lucas Samaronne de Oliveira, de 28 anos, conta que a loja está fazendo sucesso após o post da mulher, e que recebeu mensagem de vários moradores da cidade.
“Quando o marido viu a fatura, ele assustou e, de imediato, ele comunicou ela. Ela achou engraçado e postou, sem intenções. Depois, ela contou para a gente que tinha viralizado. Anápolis inteira está comentando”, contou o empresário.
A loja, que funciona há 7 anos em Anápolis, faz envios para todo o Brasil. Como eles possuem loja física e virtual, o empresário contou que isso facilitou que a mulher fizesse a compra durante a madrugada, o que contribuiu para a confusão. O pedido foi feito 1h50 de quinta-feira (13).
“Como ela fez a compra de madrugada, e ela é do Rio de Janeiro, e a loja em Anápolis, ele assustou e contou logo para a mulher”, disse.
Moradora do RJ, Ked Souza diz que marido recebeu SMS avisando da compra feita em loja de Anápolis, Goiás, e assustou — Foto: Arquivo pessoal/Ked Souza
SMS avisou marido sobre compra
Dona do perfil, Ked Souza contou que fez a compra com o cartão do marido porque cancelou todos os cartões de crédito dela. No dia, ela disse que pesquisou por “biquíni vermelho” na internet e achou a loja. Após fazer o pagamento, ela disse que o esposo recebeu um SMS avisando da compra (veja foto acima).
“Meu marido estava trabalhando e o cartão dele é salvo na minha conta. Comprei nesse horário, quase 2 da manhã, e ele chegou em casa em torno de 30 minutos depois. O banco enviou o SMS para ele”, contou.
Print que viralizou e Ked Souza, moradora do RJ — Foto: Montagem/g1, Reprodução/Redes sociais e Arquivo pessoal/Ked Souza
Ked contou ainda que, quando o marido chegou, foi direto até ela, que estava vendo TV, e avisou que estava achando que o cartão tinha sido clonado.
“Ele falou ‘recebi SMS, meu cartão foi usado numa tal Garota de Luxo de Anápolis’. Eu chorei de rir e falei ‘fui eu, garoto, comprei biquíni’. Aí ele caiu na risada também, mas estava esbaforido e apavorado”, lembra
Ked contou ainda que teve mais de 1 milhão de impressões no post e que ficou surpresa com a repercussão.
“Eu ri muito e no dia seguinte compartilhei no Twitter. A repercussão me espantou bastante”, contou.
Veja outras notícias da região no g1 Goiás.
Post que viralizou após homem do RJ achar que cartão tinha sido clonado após compra de biquíni feita em loja de Anápolis, Goiás — Foto: Reprodução/Twitter
VÍDEOS: últimas notícias de Goiás"|S|Fraude
