|index|text|flg_crime|cat_crime
134|134|"Golpistas passaram a usar redes sociais, como o Twitter, para atrair interessados em comprar e alugar cartões clonados. Por meio de apps como WhatsApp e Telegram, eles divulgam relatos de supostos clientes satisfeitos com a aquisição e exibindo produtos comprados com o dinheiro extraviado, segundo mensagens vistas por Tilt.
""Quem compra nunca se arrepender. Material tá puro lucro, vamos pra cima (sic)"", diz o dono do perfil ""Professor do 7 cartão clonado"" no Twitter, que soma 2.711 seguidores.
CONTINUA APÓS PUBLICIDADE
Relacionadas
Golpe do Pix: criminosos simulam empréstimos falsos para roubar endividados
Essa vaga de emprego pode ser um golpe: cuidado para não cair em armadilhas
Temporada de golpes para tirar dinheiro de MEIs começou; saiba evitar
Segundo especialistas consultados pela reportagem, as práticas descritas caracterizam diversos crimes, como:
fraude eletrônica;
roubo de identidade;
acesso não autorizado a computadores;
lavagem de dinheiro;
conspiração.
Por meio das contas, os criminosos oferecem os seguintes pacotes:
Cartão clássico com R$ 300 de saldo por R$ 35;
Tipo Black com R$ 900 de saldo por R$ 80;
Outros com saldo entre R$ 5 mil e R$ 8 mil custam em torno de R$ 460.
Para seduzir clientes, exibem ""casos de sucesso"": celulares, aparelhos de ar-condicionado, placas de vídeo e TV Smart comprados com os cartões e colocados nas contas de outras pessoas.
Em publicação de 4 de outubro de 2022, o perfil ""Lobo Mal CCS (cartao clonado)"", também no Twitter, exibe um print do WhatsApp em que clientes comemoram o sucesso da compra de um celular Xiaomi Redmi 10 por R$ 1.185,49, uma transação realizada com cartão clonado.
Seguido por 1.598 contas e ativo desde novembro de 2019, o perfil indica em sua descrição um link para um número no WhatsApp em que é possível negociar os cartões. A permanência desse perfil no ar por mais quase quatro anos é fato raro.
Um vendedor de cartões clonados afirmou à Tilt que as páginas de comércio do tipo nas redes sociais são derrubadas recorrentemente, fazendo com que tenham que construir uma nova identidade sempre que necessário. A tendência é comprovada pelas outras cinco contas que foram abordadas, mas não toparam falar. A constante troca de perfis, diz ele, atrapalha o lucro mensal, que varia entre vendedores. Ele não quis revelar quanto costuma faturar.
O vendedor, que pediu para não ter nome e negócio expostos, mas possui um dos perfis mais populares, com 3 mil seguidores, explica que os cartões comercializados têm três origens:
Por meio de extravios a partir de agências bancárias;
Das ruas após golpes da maquininha aplicados por ambulantes;
De dados financeiros vazados; o comércio costuma acontecer em sites da dark web (espécie de internet invisível).
Varejo de contas alugadas
Grupo no Telegram usado para vender cartões clonados
Imagem: Reprodução/Telegram
No grupo do Telegram ""CC's e Laranjas"", o vendedor que se apresenta como Braga explica diariamente que os cartões e as laranjas (contas que podem ser alugadas para despistar a origem e, por vezes, o ponto final de uma transação econômica) têm recursos e disponibilidade finitos. Portanto, os usuários devem esperar para acioná-lo.
Por volta das 12h de 7 de março, Braga anunciou no grupo: ""VOU ENCERRAR AS VENDAS MAIS CEDO HOJE!"". Em seguida, liberou a tabela de preços, prometendo que vem com ""Nome completo, CPF, Data de Nascimento..."" e que dá uma garantia caso o cartão não funcione. Antes que algum comprador desatento o chamasse, ele avisou: se não souber usar, melhor nem comprar.
As negociações ocorrem no privado, mas ele mostra, por meio de prints que não mostram o rosto de seus clientes, o sucesso das vendas e como funcionam as coisas. Numa conversa recente, um cliente, por volta das 22h, pede para comprar uma conta com saldo, para o que recebe, na manhã seguinte, uma resposta explicando que ""já tinha encerrado as vendas"".
Em outros grupos, como o ""Cartão de crédito CLONADOS E PIX ON"", que conta com 14 mil membros, o usuário identificado como Johnny Bravo Consultáveis, que se apresenta como gerente do grupo, republica diariamente o mesmo aviso: o grupo é voltado à venda de cartões e notas falsas, e a única pessoa autorizada a fazer isso é ele.
""Não negociem com esses parasitas que chamam no privado. Quem chama no privado tá desesperado para dar golpe. Não negociem com terceiros"", anuncia.
O vendedor ouvido por Tilt conta que, na mesma proporção que o comércio corre solto, há aqueles que fazem ofertas falsas para extorquir os possíveis clientes.
""São os famosos lotters: enganam os clientes afirmando fazer a entrega do material, e na hora eles somem"", explica.
Como combater a prática?
Para o delegado Thiago Chinellato, da Divisão de Crimes Cibernéticos na Polícia Civil de São Paulo, as fraudes online aumentaram assim que o covid-19 fez diversos serviços migrarem para a internet.
São diversos os crimes cibernéticos, mas com certeza, após o advento da pandemia e a migração ou aumento dos serviços e atividades na internet, observamos um aumento das fraudes nesse cenário
Thiago Chinellato, da Divisão de Crimes Cibernéticos na Polícia Civil de São Paulo
Na avaliação da advogada Adriana Cansian, especializada em segurança digital, explica que os setores público e privado ampliaram os investimentos em tecnologia e aparato legal nos últimos anos para proteger cidadãos de golpes e vazamentos de dados, como os que são comercializados no Telegram e e Twitter.
Consultada pela reportagem, a Abesc (Associação Brasileira das Empresas de Cartões de Crédito e Serviços) afirma que o Brasil avançou na segurança física, mas que o mundo digital representa um desafio.
Mais de 98% das compras presenciais feitas com cartões no Brasil são por meio de cartões com chip, e toda a base de terminais de captura (POS) está preparada para receber esse tipo de transação. Em consequência desse investimento, o setor eliminou a clonagem de cartões no ambiente físico, uma vez que as informações do chip não podem ser copiadas
Abecs
Eduardo Pires, gerente geral da Incognia no Brasil e especialista em prevenção à fraude e segurança digital, explica que os criminosos brasileiros se diferenciam dos de outros lugares por serem mais inventivos e especializados. ""O país se destaca como um dos campeões mundiais quando o assunto é criatividade e mesmo conhecimento técnico para aplicar técnicas de engenharia social.""
Para driblar os golpistas, algumas empresas apelam à tecnologia. Empresas como Banco BMG, Serasa Experian, iFood e Rappi recorrem a uma ferramenta que usa geolocalização para validar compras. Ela cruza o padrão de comportamento do usuário com a localização em que a transação está sendo feita. A partir daí, indica a possibilidade de o cliente estar sendo vítima de um golpe. Isso ajuda a evitar roubos de contas.
Já na esfera pública, Adriana Cansian explica que o desafio para combater esse tipo de fraude é implementar os aparatos legais criados para resguardar a privacidade dos usuários e punir quem vaza dados ou os utiliza sem o consentimento deles. Ela cita a LGPD (Lei Geral de Proteção de Dados Pessoais) e a criação da ANPD (Autoridade Nacional de Proteção de Dados) como estruturas positivas, mas que ainda não surtiram o efeito esperado."|S|Fraude
135|135|"Golpistas aproveitam que começo de ano é tradicionalmente época para pagar contas para enganar pequenas empresas, principalmente para as MEIs (Microempresas individuais).
A título de cobrar uma falsa taxa associativa, eles enviam cobranças fraudulentas. Tilt teve acesso a uma dessas tentativas de fraude. Para descobrir quem possui companhia aberta, eles se valem de dados públicos das empresas, informados na hora do cadastro da Receita Federal ou reunidos e vendidos na deepweb (internet profunda), afirma o presidente da ADDP (Associação de Defesa de Dados Pessoais e do Consumidor), o advogado e especialista em direito digital Francisco Gomes Junior.
CONTINUA APÓS PUBLICIDADE
Relacionadas
Golpe da maquininha e da aproximação: como proteger seu cartão no Carnaval
Por que você deve se preocupar com a etiqueta que vem na sua compra online
Brasileiros tiveram prejuízo de R$ 551 milhões com golpe online; proteja-se
No golpe, as vítimas em potencial recebem um email cobrando o pagamento de uma taxa para associar a uma entidade qualquer. Pela lei, MEIs não precisam sequer pagar essa contribuição (veja abaixo). Os golpistas chegam a ameçar os empresários. Dizem que, caso o boleto não seja quitado até a data limite, a empresa pode ser negativada.
De acordo com o credor, a associação (entidade de classe) ocorreu no dia da abertura da empresa, onde foi perguntado se gostaria de se associar a (nome da associação falsa) e foi aceito a solicitação, portanto é realmente devido esse valor
Texto da falsa cobrança
Em anexo no email, as vítimas recebem uma ""notificação extrajudicial"", que, em alguns casos, apresenta nomes falsos de associações ou de empresas devidamente registradas. Estas últimas até trabalham com auxiliam MEIs, mas não têm ligação com o golpe. Como não há código de barras no boleto, a vítima precisa fazer o pagamento via PIX.
Em alguns casos, os golpistas destacam no assunto do email expressões e frases alarmistas, como ""último aviso"" ou ""Atenção!! A não quitação do débito até a data limite PODERÁ acarretar no cancelamento do cadastro"".
Gomes Junior observa que os valores dos boletos costumam ficar em cerca de R$ 200. O pagamento exigido, no entanto, pode chegar a R$ 288,98, como o da cobrança vista por Tilt. ""O valor original do débito era de R$ 249. Porém, como não foi pago no vencimento, foi encaminhado para o Departamento Jurídico e gerou as custas"", dizem os golpistas.
Às vezes, para não ter dor de cabeça, a pessoa pensa: 'bom, vou pagar'. No que pagou, já é o golpe, em que eles ganham na quantidade. Se mandam 2 milhões de boletos falsos, torcendo para que 10%, 5% caiam, já conseguem número significativo
Francisco Gomes Junior, presidente da Associação de Defesa de Dados Pessoais e do Consumidor
As MEIs acabam virando alvo dos golpistas, explica Gomes Junior, pela própria estrutura enxuta.
""MEI é pequena, uma sociedade individual. Daí o microempresário recebe aquela cobrança e fica na dúvida. Empresas grandes já sabem o que tem de pagar, tem departamento de tesouraria/financeiro e já conseguem detectar facilmente que aquilo é falso. Vão muito em cima de MEI, porque pegam um ou outro mal informado, que, na dúvida, acaba pagando quando vê que o valor não é tão alto.""
MEIs não pagam contribuição sindical
O microempreendedor individual não é obrigado a pagar contribuição sindical, com base no Estatuto Nacional da Microempresa e da Empresa de Pequeno Porte, de 2006.
As microempresas e empresas de pequeno porte optantes pelo Simples Nacional ficam dispensadas do pagamento das demais contribuições instituídas pela União, inclusive as contribuições para as entidades privadas de serviço social e de formação profissional vinculadas ao sistema sindical, de que trata o art. 240 da Constituição Federal, e demais entidades de serviço social autônomo
Lei Complementar nº 123, de 2006
Dados cadastrais são públicos
Email e telefone de empresas são considerados dados cadastrais e são públicos, observa o advogado. Eles são informados à Receita Federal no momento da abertura do negócio e acabam sendo disponibilizados na internet. É só digitar em um buscador o nome da empresa e as palavras ""CNPJ"".
Devido a isso, esses dados cadastrais não são amparados pela LGPD (Lei Geral de Proteção de Dados). A legislação sancionada em agosto de 2018 protege apenas dados pessoais. Além disso, por serem considerados dados cadastrais, não podem ser apagados da internet, observa Gomes Júnior.
Como evitar?
A primeira recomendação para não cair neste tipo de golpe é não pagar o boleto. Na sequência, busque na internet se a associação, de fato, existe. Caso a entidade seja encontrada, entre no site dela e verifique se há alguma cobrança em seu nome. Em muitos casos, já é possível identificar o golpe neste primeiro passo.
Logo após, consulte o nome da associação na internet, especialmente em sites de queixas, como Reclame Aqui e Procon.
Também é possível verificar a autenticidade da notificação extrajudicial nos sites dos Tribunais de Justiça. Em São Paulo, é preciso consultar aqui. Já em Goiás é possível verificar aqui. No Rio de Janeiro, a consulta pode ser feita aqui."|S|Fraude
136|136|"Já imaginou ter alguém controlando seu celular à distância, fazendo tudo que quiser? Parece desesperador, mas é assim que funciona o novo golpe da mão fantasma, ou golpe do acesso remoto. E em muitas das vezes, as vítimas só percebem quando já ficaram no prejuízo.
Segundo dados do dfndr security, aplicativo antivírus que protege de golpes financeiros, até maio foram reportados mais de 3,6 milhões de bloqueios por tentativas de fraudes em dispositivos eletrônicos, um crescimento de quase 50% em relação ao ano passado.
CONTINUA APÓS PUBLICIDADE
Relacionadas
Bloqueio antirroubo e cashback: as novidades da Dimo, a conta da Motorola
'Golpe do Pix' cresce mais de 350% nos dois últimos meses
Golpe do meio período: adianta denunciar mensagem no WhatsApp? O que rola?
O golpe da mão fantasma está entre eles. A crime funciona da seguinte forma: você recebe uma mensagem dizendo que precisa realizar uma atualização e clica no link recebido. A partir daí, o criminoso acessa seus dados remotamente e, nesse momento, é possível notar a movimentação sendo realizada na tela, como se fosse uma mão fantasma.
A forma que as pessoas recebem esses links pode variar, geralmente por sms, WhatsApp ou e-mail. Mas sempre há um trabalho de engenharia social, onde o golpista se passa por alguém conhecido ou por um funcionário do banco, informando uma movimentação suspeita que exige uma atualização de segurança.
Justamente por criar uma situação tão difícil de identificar de primeira, a engenharia social costuma ser eficiente. Com mensagens, criação de contextos coerentes, ligações falsas e links suspeitos, os criminosos convencem a vítima a realizar as ações necessárias.
Como evitar cair neste golpe
Existem algumas dicas simples para evitar que golpistas invadam seu celular através do golpe da mão fantasma. Entre elas:
Não clique em links suspeitos: é sempre melhor entrar em sites oficiais e navegar por lá. Além disso, vale a pena verificar se o domínio do link é o mesmo da página oficial do site;
Não anote senhas no celular: não salve os códigos em arquivos e pastas, pois podem ser acessadas por invasores. Gabardo diz que memorizar senhas é chato, mas é melhor a chateação de mudar uma senha quando esquecê-la do que a dor de cabeça de tê-la em mãos erradas;
Varie as senhas entre os diferentes aplicativos: se você cair em algum golpe, o efeito será menos grave;
Atualize seus aplicativos: as atualizações devem vir de fontes oficiais, mas são elas que garantem que os apps estejam protegidos contra gaps de segurança;
Instale aplicativos apenas de fontes oficiais: os fabricantes de sistema operacional possuem um rigoroso processo de verificação, aprovação e publicação de aplicativos nas lojas oficiais. As fraudes partem de links e outros apps;
Use a autenticação de dois fatores: configure a autenticação em duas etapas nos principais aplicativos, especialmente naqueles que envolvem dinheiro. Ao adicionar mais uma etapa, na hora do acesso, você precisa colocar a senha e, em seguida, confirmar no e-mail ou com SMS;
Desconfie sempre: mesmo se o link vier do banco ou de um amigo, ligue para eles, procure explicações. E fique de olho em matérias como esta, que deixa você atualizado sobre o ""golpe da vez"".
O que devo fazer se cair no golpe
Se mesmo assim você cair no golpe, assim que perceber que algo está acontecendo no celular, como aplicativos abrindo sozinho, desconecte a internet e desligue o aparelho.
Esse primeiro passo pode atrasar a movimentação dos golpistas, mas ainda não é a solução final.
O próximo passo é passar um antivírus para limpar tudo. Aqui, é importante reforçar que o programa seja baixado da loja oficial de aplicativos. Não procure por opções duvidosas ou piratas!
Se, ainda assim, você não estiver se sentindo seguro, restaure o celular aos padrões de fábrica.
Tomadas essas medidas de emergência, é importante abrir um Boletim de Ocorrência (BO) e, se for o caso, contatar um advogado para ter orientações detalhadas de como proceder.
*Com informações do site PagSeguro"|S|Cybercrime
137|137|"O programa Auxílio Brasil, oferecido pelo Governo Federal, começou a ser utilizado como isca em um novo golpe que se popularizou rapidamente. Só na semana passada, foram identificadas 20 mil tentativas de fraude por dia.
Os dados são da empresa de cibersegurança PSafe, que, no mesmo período, tirou do ar 17 sites que usavam o nome do benefício para atrair suas vítimas.
CONTINUA APÓS PUBLICIDADE
Relacionadas
'Pague R$ 20 e receba R$ 200': cuidado com o novo golpe do 'Robô do Pix'
Titi Müller e o golpe da senha: veja como se proteger após roubo de celular
5G no Brasil: veja 4 coisas que mudam na prática com chegada da tecnologia
A maioria aplicava uma técnica de phishing: a captura de dados pessoais quando a pessoa é convencida a clicar em um link.
""É por isso que temos números tão altos e em pouco tempo: o phishing tem um poder de disseminação extremamente veloz"", afirma o executivo-chefe de Segurança da PSafe, Emilio Simoni.
Como é o golpe
Na maioria dos casos, o cibercriminoso envia à vítima uma mensagem informando que ela pode ter direito ao repasse do programa federal. Geralmente, a mensagem é disparada por WhatsApp, mas também pode chegar via SMS ou email.
Algumas prometem até R$ 2.500, valor seis vezes maior que o pago atualmente pelo governo (R$ 400; a partir de agosto, R$ 600). E informam que o dinheiro poderá ser transferido instantaneamente, por Pix.
Tudo isso, claro, são falsos argumentos para estimular a pessoa a clicar em um link onde ela pode consultar se realmente ""tem direito"" ao benefício. Lá, ela precisa inserir seus dados pessoais (inclusive a chave Pix), que são o verdadeiro objetivo dos golpistas.
Em muitos casos, as mensagens replicam as cores utilizadas nas peças de comunicação do Governo Federal ou do Auxílio Brasil.
Também houve exemplos com um botão obrigatório de ""Compartilhar"" antes de coletar o benefício. Assim, a vítima repassava o mesmo golpe para outras pessoas.
""Um agravante no caso do phishing é que a pessoa pode não se dar conta no momento do golpe. Eles coletam os dados para serem utilizados posteriormente, então a pessoa pode demorar meses para saber e, mesmo assim, nem se lembrará que pode ter relação com um cadastro fraudulento"", destaca Simoni.
Como se proteger do golpe? 4 dicas práticas
1. Tenha um programa de segurança instalado no dispositivo para bloquear, em tempo real, links maliciosos em navegadores, WhatsApp, SMS e Messenger. Uma sugestão é o dfndr security.
2. Desconfie de promoções, propostas e descontos, especialmente com valores muito tentadores. É possível verificar, em lojas conhecidas ou nos sites oficiais das marcas, se as ofertas são verdadeiras.
3. Não informe dados pessoais em cadastros de sites que você não conhece.
4. Recebeu uma mensagem suspeita com link? É possível utilizar um verificador de URLs para saber se o site é legítimo ou não."|S|Golpe bancário
138|138|"Golpes envolvendo transferência de dinheiro via Pix cresceram mais de 350% em abril e maio, em relação a fevereiro e março. E agora já tem uma nova modalidade na praça, que está sendo chamada de ""Robô do Pix"" ou ""Urubu do Pix"".
Contas em redes sociais prometem dinheiro fácil, desde que a pessoa faça uma transferência primeiro. São chamadas como ""Pague R$ 20 e receba R$ 200"" ou ""Pague R$ 50 e ganhe R$ 500"".
CONTINUA APÓS PUBLICIDADE
Relacionadas
Fim da magia? Apple encerra acordo com guru do design de Steve Jobs
Exclusivo: engenheiro do Google revela detalhes da 'IA com mente própria'
James Webb: veja fotos impressionantes de Júpiter 'escondidas' em arquivo
Um estudo da empresa PSafe, especializada em cibersegurança, revelou que esses perfis falsos compõem uma rede que já soma mais de 654 mil seguidores. E ela é toda automatizada - daí o apelido do golpe.
O objetivo é obter não apenas o dinheiro da vítima, mas também seus dados confidenciais, que podem ser usados em outros golpes.
Reprodução de postagem em conta de ""Robô do Pix""
Imagem: PSafe/Reprodução
""De janeiro a junho, já bloqueamos quase 12 milhões de tentativas de estelionato virtual, que são golpes que tentam induzir as vítimas a realizar algo, como transferência bancária ou fornecimento de dados sensíveis, com o objetivo de obter ilicitamente alguma vantagem"", diz o executivo-chefe de segurança da PSafe Emilio Simoni. ""Isso quer dizer que, por dia, tivemos mais de 65 mil tentativas. É um número bem alarmante.""
Há ainda variações do golpe. Em uma delas, os golpistas entram em contato com a vítima e avisam que ela ganhou um prêmio em dinheiro. Em outra, é oferecido um sorteio do PIX. Em ambas, os criminosos pedem que a vítima acesse um link e preencha dados pessoais e bancários para solicitar o resgate. Com essas informações em mãos, os criminosos acabam fazendo a clonagem do cartão de crédito, por exemplo.
Como se proteger?
Para evitar cair em golpes, é necessário seguir algumas recomendações:
Desconfie de qualquer oferta ou promoção online que ofereça uma grande vantagem, principalmente as que solicitam preenchimento de dados pessoais para a obtenção do prêmio;
Não clique em links enviados por mensagem ou emails;
Nunca informe dados sensíveis em links de procedência duvidosa;
Procure sempre confirmar a veracidade das informações em páginas e sites oficiais das marcas, quando se tratar de uma promoção ou oferta de lojas conhecidas.
Mantenha o antivírus atualizado."|S|Cybercrime
