|index|text|flg_crime|cat_crime
95|95|"O Procon de São Paulo já notificou as duas empresas que lideram o segmento de delivery de comida por causa desta e de outras denúncias e promete pedir investigação policial. Rappi e iFood afirmaram que estão apurando os casos.
O iFood disse ao G1 neste sábado (25) que fará o reembolso para quem sofreu o golpe, desde que apresente o boletim ocorrência e o extrato bancário comprovando a fraude.
Já a Rappi diz que devolução dos valores deverá ser feita pela operadora do cartão de crédito ou débito, o que é contestado pelo Procon (leia mais abaixo).
Veja como evitar golpes na compra online
Nunca comprou pela internet? Veja passo a passo
Golpe da 'taxa extra'
Segundo a queixas recebidas pelo Procon-SP, o golpe funciona da seguinte forma: depois de o cliente fazer o pedido no aplicativo, uma pessoa telefona para a vítima se identificando como funcionária da empresa, dizendo que houve problema no pagamento do frete e que taxa deverá ser paga pessoalmente.
Quando o entregador chega, ele apresenta uma máquina de cartão com o visor danificado, o que impossibilita checar o valor cobrado. Nisso, é digitado um valor muito maior do que o anunciado e a vitima só descobre quando vê a fatura do cartão.
Rappi e iFood orientam que não entram em contato com os usuários por telefone, que não fazem cobrança extra pessoalmente para pagamentos feitos online.
Eles recomendam que os usuários sempre chequem o valor cobrado na máquina de cartão e que se recusem a pagar, caso não seja possível verificar.
O secretário especial de Defesa do Consumidor de São Paulo, Fernando Capez, afirmou que o Procon pedirá a abertura de inquérito policial no estado para investigar os profissionais denunciados por furto qualificado e organização criminosa.
Além disso, disse ele, as empresas serão alvo de um processo administrativo, que, se comprovar alguma irregularidade, poderá resultar em multas de até R$ 10,6 milhões, a depender do faturamento da companhia.
""Os consumidores lesados teriam entrado em contato com o serviço de atendimento do aplicativo, mas alegam que não tiveram uma solução definitiva"", disse o Procon, que afirmou ter recebido 35 denúncias sobre a fraude.
Prejuízo de R$ 6 mil
O administrador Giovani de Brito Junior, de 36 anos, afirma que foi vítima do golpe e que o prejuízo dele foi de R$ 6.004,99. O caso ocorreu na noite do último dia 13, quando ele pediu um milkshake em uma lanchonete localizada na Avenida Paulista, em São Paulo.
Após realizar o pedido pelo app do iFood, Giovani afirma que recebeu um telefonema de uma pessoa que se identificava como funcionária da empresa, ""dizendo que houve problema com o pagamento online da minha taxa de entrega e que eu teria que pagar mais entrega, mas que teria o reembolso no cartão"".
Giovani checou aplicativo do cartão de crédito após desconfiar da cobrança extra feita pelo entregador — Foto: Arquivo Pessoal/Reprodução
Ao receber o pedido, Giovani afirma que colocou o cartão de crédito em uma máquina portátil, de um modelo que sincroniza com o celular, mas no visor dela não aparecia o valor cobrado.
Questionado, o entregador disse que o aparelho estava com problema, mas que o montante poderia ser verificado em outra maquininha, que apresentou para a vítima e que estava com o valor de R$ 4,99.
Minutos depois da entrega, o administrador desconfiou e foi checar a fatura do cartão. Nisso, encontrou o pagamento dos R$ 6 mil, feito em nome de Nikolas, que, segundo a vítima, não era o mesmo nome do entregador que apareceu no app.
Giovani de Brito Junior foi vítima golpe aplicado por um entregador — Foto: Arquivo Pessoal
Giovani registrou um Boletim de Ocorrência, cancelou o cartão de crédito, fez queixa ao Procon e procurou o iFood, que, em um primeiro momento, afirmou que não tinha responsabilidade sobre o caso e que a questão deveria ser resolvida pela operadora do cartão.
Após ser procurado pelo G1, na última quinta-feira (23), o iFood entrou em contato com Giovani e o cliente disse que foi reembolsado pela empresa na sexta (24).
Outras denúncias
No portal Reclame Aqui existem outros relatos recentes sobre golpes parecidos com o que Giovani contou à reportagem. Em outro caso também atribuído ao iFood, um usuário relatou que, após pedir em um restaurante de comida australiana de um shopping do ABC Paulista, também teve prejuízo superior a R$ 6 mil.
Usuário reclama de golpe aplicado por entregador do app iFood — Foto: Reprodução/Reclame Aqui
Também há relatos de golpes relacionados ao aplicativo Rappi, com valores altos.
Usuário relata tentativa de golpe por um entregador do app Rappi — Foto: Reprodução/Reclame Aqui
Como ter o dinheiro de volta?
No caso do iFood, a empresa informa que os consumidores afetados pela fraude devem registrar boletim de ocorrência e entrar em contato pelos canais oficiais de atendimento ao cliente via aplicativo, enviando o B.O. e extrato bancário, para que a empresa possa analisar o caso.
""Vale ressaltar que essa prática fraudulenta afeta tanto os consumidores quanto o iFood, que, em apoio aos clientes, tem atuado para ressarci-los dos prejuízos mesmo diante de uma fraude aplicada em aparelhos de pagamento que não pertencem à empresa"", diz a empresa, em nota.
Segundo Fernando Capez, as empresas de entrega não poderão se negar a reembolsar o dinheiro e devem ser responsabilizadas pelo golpe também, independentemente se há ou não vínculo trabalhista com esses entregadores.
Para o Procon, de acordo com o Artigo 34 do Código de Defesa do Consumidor, iFood e Rappi precisam responder pelos atos desses entregadores enquanto estes estiverem representando a plataforma.
""Eles são responsáveis pelos atos dos funcionários que os representam, são profissionais que estão com o uniforme da empresa. Eles (empresas) têm culpa por não ter supervisionado, por não ter escolhido direito este entregador. Quem determina a responsabilidade não é a empresa, é a lei"", explica Capez.
A recomendação do secretário é de que as vítimas deste golpe façam uma reclamação ao Procon de seu estado e registrem um Boletim de Ocorrência, seja online ou na delegacia do consumidor. Depois disso, é preciso aguardar o desfecho das investigações.
iFood diz que apura golpes
Em resposta à notificação do Procon, na quarta-feira (22), o iFood disse ter identificado 28 fraudes do tipo.
Em nota, o iFood diz que, quando o consumidor opta pelo pagamento online, em nenhuma hipótese é exigido pagamento adicional na entrega do pedido, e que a empresa não entra em contato por telefone em nenhum momento. Se isso ocorrer, afirma, o usuário deve se negar a fazer qualquer pagamento.
A empresa recomenda aos consumidores, que, em qualquer tipo de transação envolvendo cartão, chequem o valor no visor da máquina e não insiram a senha caso não vejam claramente o valor.
""Caso tenha efetuado qualquer operação sem que haja certeza do valor, recomenda-se que, assim que finalizada a transação,verifique no aplicativo do seu banco o valor debitado e, havendo divergência, solicite o cancelamento imediato.""
A companhia confirmou que procurou Giovani de Brito Junior para esclarecer o ocorrido e que iria investigar o caso.
""Ao receber relatos como esse, a empresa realiza uma apuração interna e, caso seja comprovada qualquer conduta irregular, desativa os cadastros imediatamente, conforme expresso nos termos e condições"", afirmou o iFood.
Rappi recomenda procurar autoridades
A Rappi também afirmou que não realiza pagamentos com máquinas de cartão e que instrui os entregadores a seguirem integralmente as leis.
Disse ainda que existe um canal de atendimento aos clientes dentro do aplicativo para reportar ""qualquer problema na plataforma"".
""A Rappi recomenda que, caso (os usuários se sintam) lesados, façam boletim de ocorrência e registrem pedido de cancelamento na operadora de cartão de crédito.""
O Procon também notificou a Rappi na quarta e a plataforma deverá dar os seguintes esclarecimentos:
Se teve registros de golpe na plataforma e, em caso positivo, quantos?;
Quais as providências adotadas?;
Quais os critérios impostos para aceite do estabelecimento comercial na utilização da plataforma ?
Quais as providências adotadas perante o parceiro, quando da ocorrência de denúncia dessa natureza?
""A empresa informa que sempre analisa os casos reportados, toma as medidas necessárias de acordo com os Termos e Condições do aplicativo e está à disposição dos órgãos competentes para quaisquer necessidades de esclarecimentos"", completou a Rappi em nota ao G1.
Reclamações aumentam no isolamento
A pedido do G1, o Reclame Aqui listou as reclamações gerais feitas contra as duas plataformas desde o começo do ano.
Nos dois casos, houve aumento significativo a partir de março, início do período de isolamento social no país, o que fez aumentar a procura por esse tipo de serviço.
O iFood somou 12.190 reclamações até o dia 21 de abril, índice próximo ao que foi registrado em todo o mês de janeiro e de março.
Reclamações contra o iFood em 2020 — Foto: Arte G1
Já a Rappi contabilizou nos 21 dias de abril mais reclamações do que foi o registrado em qualquer mês deste ano.
Reclamações contra a Rappi em 2020 — Foto: Arte G1
No estado de São Paulo, o Procon-SP informou que houve aumento de 109% nas reclamações de consumidores relacionadas a compras pela internet no primeiro trimestre de 2020.
Foram 35.789 casos nos três primeiros meses deste ano, contra 17.108 casos no mesmo período de 2019.
As principais reclamações são:
Demora ou não entrega do produto;
Cobrança indevida ou abusiva;
Produtos com defeito;
Problemas com contrato (rescisão, descumprimento, erro);
Serviço não fornecido;
Cancelamento da compra;
Entrega diferente do pedido."|S|Fraude
96|96|"⚠️A investigação começou após moradores do RS procurarem a Polícia devido a perdas milionárias. Um homem depositou R$ 1,8 milhão no falso investimento. Outro chegou a perder R$ 4 milhões, diz a polícia.
📲 Acesse o canal do g1 RS no WhatsApp
De acordo com o delegado Juliano Ferreira, responsável pela investigação, os suspeitos do golpe captavam clientes pela internet e apresentavam uma falsa plataforma de investimento, com site e aplicativo para celular. Nesse sistema, as vítimas receberiam a promessa de ganhos acima da média, diz a Polícia.
Em um dos casos, um morador do Rio Grande do Sul depositou cerca de R$ 4 milhões na conta de um dos presos. Há casos investigados, também no RS, de pessoas que investiram R$ 1,5 milhão, R$ 1,8 milhão e R$ 2,5 milhões.
""Ainda não temos como precisar o número de vítimas, mas temos certeza que o golpe era aplicado em todo o Brasil, não só no Rio Grande do Sul. Estamos sendo procurados diariamente por vítimas"", diz o delegado.
Segundo a Polícia Civil, o braço operacional da suposta quadrilha fica em Natal, no Rio Grande do Norte. De lá, teriam criado empresas de fachada, contas fantasmas e entrado em contato com possíveis vítimas.
A promessa, segundo a polícia, é de que para ter ganhos maiores, seria necessário deixar o dinheiro na plataforma por mais tempo. Quando a vítima insistia em retirar o dinheiro antes, no entanto, os suspeitos passavam a dificultar o contato.
Falsa empresa
A falsa empresa era apresentada como um corretora internacional de investimentos e dizia fazer parte de um dos maiores bancos de investimentos no mundo. Segundo a polícia, o golpe contava ainda com um assessor, que entrava em contato com as vítimas por meio de ligações e mensagens no WhatsApp, inclusive com assinatura de um falso contrato em inglês.
""Eles começam a apresentar falsos investimentos ainda mais lucrativos dentro da plataforma. Quando chega o momento de reaver os valores, a vítima dizia que queria tirar os rendimentos e não conseguia mais contato. Eles começam a enrolar. A plataforma não tem um canal para sacar o valor, depende do intermediário, e aí ele para de responder. É quando as vítimas costumam perceber que caíram no golpe"", conta o delegado.
Operação
Em 22 de maio, foram cumpridas 12 ordens judiciais, entre mandados de prisão, de busca e apreensão e indisponibilidade de bens, todas em Natal (RN). Três pessoas foram presas.
O caso que iniciou a investigação foi o de um homem de 71 anos, morador de Porto Alegre, que investiu R$ 1,8 milhão na plataforma falsa. Segundo a apuração, o falso lucro prometido pela plataforma neste caso chegaria a R$ 5 milhões.
""Quando as vítimas vêm registrar ocorrência, elas dizem que perderam R$ 5, 6, 7 milhões, que é o valor de lucro que aparece na plataforma. Eles acham que não estão conseguindo sacar o dinheiro, mas ainda não percebem que é tudo golpe"", diz o delegado.
A polícia agora investiga outras denúncias de falsos investimentos e tenta encontrar ligação desses casos com os suspeitos presos no Rio Grande do Norte. ""Não tenho dúvida que faremos a fase 2 desta operação"", afirma o delegado.
Três pessoas foram presas no Rio Grande do Norte suspeitas de aplicar golpe do falso investimento no RS — Foto: Divulgação/Polícia Civil
VÍDEOS: Tudo sobre o RS
50 vídeos"|S|Fraude
97|97|"Segundo registro da ocorrência, a idosa, moradora do Jardim Elite, recebeu uma ligação no telefone fixo da residência em que o suspeito se identificou como funcionário do banco onde a vítima tem conta.
📲 Acesse a nova comunidade do g1 Piracicaba e fique por dentro das notícias da região
O falso atendente justificou o contato com a necessidade de confirmação de uma suposta transação no valor de R$ 1.975 que teria sido feita durante compra em loja de departamentos. Diante da negativa, o suspeito afirmou que era preciso bloquear o cartão da idosa e cancelar a compra.
Polícia Civil investiga caso — Foto: Fernando Jacomini/G1
Para isso, solicitou fornecimento do número do cartão e do código de segurança que fica no verso. Ao chegar em casa e perceber que a mãe estava ao telefone, a filha da idosa chegou a falar com o falsário.
Desconfiada do golpe, a filha ligou no banco e, em contato com o gerente, foi informada que se tratava de um golpe e que um empréstimo de R$ 19 mil tinha sido feito em nome da idosa. Desse valor, dois boletos de R$ 5 mil e R$ 4 mil foram pagos em operação pela internet.
📞Conheça os golpes 'mais comuns' com falsos funcionários 🔍
Golpe no telefone fixo ☎️
Falsários ligam para telefones fixos e se passam por funcionários de bancos e instituições financeiras, informando sobre supostas compras suspeitas ou demais irregularidades. Nesses casos, os criminosos têm objetivo de subtrair dados bancários, senhas e dinheiro das vítimas.
Golpe da falsa central 👨‍💻
Nesse tipo de golpe, os criminosos induzem a vítima a fazer uma ligação para a central de atendimento ao cliente. Durante a ligação, os golpistas simulam uma central de atendimento e pedem para a pessoa digitar senhas. O objetivo, segundo alertas das instituições, é obter senhas, dados pessoais, além de números de cartões, códigos de segurança.
‘Golpe do 0800’ por suposta compra ou problema em cartão 💳
Golpistas informam, por meio de mensagem, sobre uma transação suspeita ou compra. No texto, é indicado um número 0800, que na verdade se trata de falsa central telefônica de um banco ou de uma área de cartões de crédito.
Golpe da transferência 📱
Criminosos entram em contato com a vítima por ligação ou mensagens em aplicativos de conversas como o WhatsApp. Nas mensagens, os fraudadores informam sobre suposta irregularidade na conta bancária da pessoa. Simulam um atendimento e a induzem ou conduzem a realizar transferências.
Como se proteger?
As instituições financeiras orientam aos correntistas para que:
Nunca falar ou digitar senhas ao teclados de telefones durante ligações;
Se receber ligações suspeitas por telefone fixo, comunique ao banco imediatamente
Não informar dados de conta bancária, de cartão ou senhas para ninguém.
Se suspeitar de algo, ligue para a central de atendimento por meio dos números e canais oficiais fornecidos pela instituição bancária. Geralmente, os telefones das centrais estão presentes no
Outro caso
Uma médica de Piracicaba (SP) procurou a Polícia Civil da cidade, nesta terça-feira (2), para denunciar o golpe que sofreu após entrar com uma ação judicial para revalidar o diploma do curso superior de medicina realizado na Bolívia.
Segundo informações do boletim de ocorrência, criminosos teriam se passado por representantes de um escritório de advocacia e solicitaram transferências que, somadas, totalizaram R$ 13,5 mil.
A vítima desconfiou em entrou em contato com a responsável pelo escritório, que afirmou não ter sido a responsável pelas mensagens. O caso foi registrado pelo polícia como estelionato e é investigado.
Veja mais notícias da região no g1 Piracicaba"|S|Golpe bancário
98|98|"Batizado de ""Golpe das P* Extorsão"", o documento interceptado pelos policiais da 17ª DP (São Cristóvão) é dividido em cinco tópicos, com o passo a passo para a aplicação do golpe.
Veja as orientações dos criminosos:
""1 - Primeiro de tudo, meus amigos, sobe vários perfis de acompanhantes em vários lugares (na internet). Encaminhem pro whatsapp.
2 - Agora, você vai vendo os caras que vai chamar, marcando com eles horário fingindo que é a p* (prostituta).
3 - Agora vem o golpe: Tem muito cara que marca e some e não vai. Você vai fazer o seguinte: puxa os dados dele e toma muito cuidado nessa parte. Pega um chip laranja, não conecta em wifi, usa só 4G e faz um whatsapp.
4 - Chama o bico (vítima) e ameaça ele, fala que tu é cafetão da facção da sua cidade. E que ele tem que pagar uma taxa de R$ 100. Manda o endereço dele e fala que vai passar lá. Fala que ele ta fazendo suas p* (prostitutas) perderem tempo marcando com elas.
5 - Bico (vítima) vai se borrar todo, usa uma lara (laranja) e some com o chip depois da extorsão e vai fazendo o trampo.""
Dois presos e uma foragida
Na última sexta-feira (13), policiais da 17ª DP (São Cristóvão) prenderam duas pessoas envolvidas no esquema de extorsão que utilizava falsas garotas de programa para atrair vítimas. Ryan Carlos Reis Lima e Sarah Santos Borges foram presos e Rayene Carla Reis Lima está foragida da Justiça.
Segundo a polícia, os três adaptaram o golpe que estava escrito no manual e começaram a fazer vítimas no Rio de Janeiro. Os golpistas conversavam com os alvos, pediam fotos de partes intimas e pegavam seus dados pessoais. No dia seguinte, eles se passavam por milicianos e cobravam pelo suposto programa da noite anterior, ameaçando os 'clientes' de morte.
""Se eu chegar na sua casa não tem conversa""; ""Te dei a chance de resolver""; ""Quer brincar com miliciano""; ""Se não tiver com o valor vamos te matar"", diziam os golpistas.
Segundo os investigadores, pelo menos 30 pessoas sofreram com o golpe. A TV Globo teve acesso a algumas das mensagens trocadas pelos criminosos com as vítimas. Os suspeitos pediam entre R$ 600 e R$ 3,5 mil para não expor os alvos nas redes sociais.
Falsa garota de programa
De acordo com a Polícia Civil, o golpe aplicado pelo trio funcionava em duas partes. Primeiro, uma mulher se apresentava como garota de programa e puxava assunto com os alvos do bando.
Sarah Santos Borges foi presa nesta sexta-feira (13) — Foto: Reprodução
Quando ela conseguia atrair um suposto ""cliente"", eles começavam a conversar por meio de aplicativos de troca de mensagens. Conforme o papo ia esquentando, a mulher pedia para a vítima mandar fotos de partes intimas ou se masturbando.
Após algum tempo, o papo era finalizado ali mesmo, sem nenhum contato físico entre a mulher que integrava o grupo criminoso e a vítima.
No dia seguinte, uma outra pessoa começava a segunda etapa do golpe: pesquisa e extorsão. O grupo conseguia reunir o maior número de informações possíveis dos alvos, como dados pessoais dele e de parentes, além do endereço da vítima.
Com essas informações, os golpistas entravam em contato com a vítima se passando por milicianos. Segundo as conversas interceptadas pela Polícia Civil, o criminoso dizia para a vítima que ele tinha deixado de comparecer em um suposto programa com a mulher que ele havia conversado na noite anterior.
Ryan Carlos Reis Lima foi preso em flagrante com um revólver 38 — Foto: Reprodução
Nas mensagens obtidas pela TV Globo é possível ver que os golpistas diziam que o ""cliente"" teria que pagar pelo falso programa e mais uma taxa por ter feito a falsa garota de programa perder outro cliente.
A extorsão seguia com muitas ameaças de exposição das fotos da vítima em redes sociais ou para filhos e esposas, além de mostrar que eles sabiam de dados sensíveis da vítima, como endereço, nome completo e CPF, por exemplo.
Os investigadores da 17ª DP estão reunindo os registros feitos sobre crimes como esse para contabilizar o número total de vítimas do bando. Até o momento, são 31 registros de ocorrência contra o grupo que aplicava o golpe do falso programa.
Segundo a delegada Márcia Beck, responsável pela investigação, o número de vítimas deve ser bem maior do que o dado oficial, visto que as pessoas têm vergonha de denunciar a extorsão pela natureza do crime.
Ryan Carlos Reis Lima foi preso em flagrante com um revólver 38 e Rayene Carla Reis Lima está foragida da Justiça — Foto: Reprodução"|S|Fraude
99|99|"🚨Os criminosos ainda ameaçam bloquear o suposto valor devido caso o pagamento da taxa não seja realizado imediatamente. Esses pedidos são #FAKE (leia mais abaixo).
Um beneficiário, que preferiu manter a identidade em sigilo, recebeu um desses boletos — que imita um documento oficial numa página que simula o portal do governo ""gov.br"". O boleto é acompanhado de uma mensagem de voz.
Reproduzir vídeo
INSS: Aposentados denunciam golpe do consignado
Em um trecho da mensagem, uma voz feminina diz: ""Você está a um passo de receber sua indenização.""
🚨Em outro momento, promete pagamento do ressarcimento pela chave PIX do beneficiário — algo que o INSS reiterou que não é feito.
""É necessário efetuar o pagamento do imposto sobre o valor da sua indenização [...]. Após você finalizar o pagamento sobre essa taxa de imposto, você receberá o valor completo na sua chave PIX no mesmo minuto"", diz outro trecho da mensagem do golpe.
Os golpistas ainda reforçam a necessidade do pagamento rápido do valor sob a ameaça de bloqueio da indenização.
No caso específico desse beneficiário, a taxa do boleto falso é de R$ 61,90 e do suposto ressarcimento de R$ 5.960,50.
No documento falso ainda constam os termos ""indenização governamental"" e ""vazamento de dados pessoais"".
Prédio do Instituto Nacional do Seguro Social (INSS). — Foto: Rafa Neddermeyer/Agência Brasil
LEIA MAIS:
Idosa descobriu que teve descontos indevidos do INSS por 30 anos após escândalo de fraudes
CPI pode comprometer sucesso da investigação policial e atrasar ressarcimentos, diz Gleisi
Lula se reúne com ministros no Alvorada para debater estratégia frente à crise do INSS
Alertas do INSS
O INSS vem alertando as vítimas sobre os golpes e sobre as notícias falsas desde que a fraude veio a público.
Outra estratégia dos golpistas é enviar mensagens que oferecem um link para supostamente agilizar a devolução dos valores descontados.
🚨O conteúdo dessas mensagens também é #FAKE e visa roubar dados pessoais das vítimas.
Em entrevista ao g1 nesta quinta-feira (15), o presidente do INSS, Gilberto Waller, alertou que o órgão entra em contato com os cidadãos apenas pelo aplicativo ""Meu INSS"".
O próprio telefone oficial 135 ""não liga pra você"", reforçou na ocasião. ""Você querendo, você liga para o 135.""
""Não aceite nenhum intermediário nesse procedimento. Ele é muito simples. Não abra link, não assine nenhum documento, não junte documento. O INSS não cobra nada de você. Então, fique atento. Se alguém bater na sua porta, oferecendo uma facilidade, é golpe"", afirmou o presidente.
O INSS reforçou, via assessoria de imprensa, que os beneficiários não devem aceitar ajuda de estranhos ou repassar seus dados pessoais.
""É preciso desconfiar de mensagens com promessas fáceis e em caso de dúvidas buscar informações apenas pelos canais do INSS ou demais páginas oficiais do governo"", informou o INSS."|S|Fraude
